date,identifier,tweets
2022-01-18 17:42:05+00:00,c,Microsoft's Activision bid will make it a gaming giant — but it comes with one giant catch https://t.co/Kp7rxBaoul by @DanielHowley https://t.co/z72CaeBVX1
2022-01-18 17:41:26+00:00,c,Microsoft buying Activision is a $68.7 billion bet on the metaverse: tech analyst https://t.co/giOzQKEeUA by @BrianSozzi https://t.co/0qDGlugzbx
2022-01-18 17:40:27+00:00,c,"Goldman Sachs CEO: Wage inflation happening 'in every area of the economy'
 https://t.co/LrbK77LYxL by @bcheungz https://t.co/mmmqgLzb54"
2022-01-18 17:27:01+00:00,c,"“This sell-off represents some opportunity,” The Wealth Consulting Group CEO Jimmy Lee says about bank stocks. “I’m not worried about financials. I think with rising rates, financial sectors will continue to do well.” Full interview: https://t.co/WYDAXlHeEd"
2022-01-18 17:22:30+00:00,c,"“This is a great extension and, oh, by the way, smart timing on Microsoft’s part,” TECHnalysts Research President @bobodtech says about Microsoft’s acquisition of Activision Blizzard. Also discusses the 5G rollout: https://t.co/AZ6mYLnFsd"
2022-01-18 16:57:35+00:00,c,"""The metaverse right now for a lot of average users is not that easy to access,"" @CoinDesk's @emilydparker says, noting that Big Tech could help with access — but ""we could see the danger of monopolization of the space that's supposed to be decentralized."" Full comments: https://t.co/thG7rE5ImH"
2022-01-18 16:47:07+00:00,c,"JMP Securities Director of Financial Technology Research Devin Ryan on Goldman Sachs: ""I think the stock reaction today is a bit of an overreaction."" $GS down 8%. Full interview: https://t.co/MaKXeJvKHb"
2022-01-18 16:33:50+00:00,c,"""It's really interesting to see markets digest this transition from green light Go to yellow light Caution,"" @FSInvestments Chief Market Strategist Troy Gayeski says, adding: ""It's just a much different environment than we've been in since the pandemic bottom."" Also talks $BTC: https://t.co/V151KBlMOF"
2022-01-18 16:19:46+00:00,c,"Markets selling off, with major U.S. indexes down more than 1.5% and 10-year T-note yields rising. @spyjared with the latest across sectors: https://t.co/2XX6BS2y98"
2022-01-18 16:16:33+00:00,c,"Truist Securities Equity Research Director Matthew Thornton on the $MSFT-$ATVI deal, what it means for the gaming space, Big Tech, and metaverse ambitions: ""Microsoft is clearly betting on content."" Full interview: https://t.co/hvHnYyeD88"
2022-01-18 16:06:11+00:00,c,"“We’re spending a lot of time on decentralized internet infrastructure,” @CastleIslandVC partner @nic__carter says. “It’s very important... we build tools for people to communicate and interact with each other online without deferring to huge Silicon Valley tech corporations.” https://t.co/zq4MUarCPs"
2022-01-18 16:05:55+00:00,c,.@DanielHowley provides more context on $MST acquisition of $ATVI: https://t.co/am3oJVnYJJ
2022-01-18 16:01:09+00:00,c,"“Gaming is going to be the first piece in the metaverse in terms of monetization,” @Wedbush senior equity analyst @DIvesTech says. “It’s really about streaming… it’s a scarcity of assets.” https://t.co/Urqhcp97sg"
2022-01-18 15:56:36+00:00,c,"“We’re starting to see higher interest rates, but starting to see the beginning of our change in fees,” @abrdn_US Senior Bank Analyst Jon Curran says. “I think trading revenues are going to be a little lighter, because the pandemic induced volatility is beginning to fade."" https://t.co/c82ewoQFoh"
2022-01-18 15:53:32+00:00,c,"“Being controlled by regulation is difficult sometimes to build a business,"" @Tilray CEO @IrwinDSimon says. ""We have a strong business in Canada with 12 brands… but Canada is 37 million in size and there’s only so much you can build in Canada.” https://t.co/UQ0oSuMFbd"
2022-01-18 15:51:55+00:00,c,"Remote work largely 'here to stay,' economist says https://t.co/r0sSlKSP8M by @thomashumTV https://t.co/xxFcixfZ3w"
2022-01-18 15:51:16+00:00,c,What happens to the stock market when interest rates rise? https://t.co/qjwH3jIfSa by @BrianSozzi https://t.co/HILhCkvNMl
2022-01-18 15:50:37+00:00,c,4 things Biden got right in a bumpy first year https://t.co/d9DWvkeKpg by @rickjnewman https://t.co/F42hhaiSXD
2022-01-18 15:44:53+00:00,c,"“The whole thing we have to worry about is what would happen with the Fed providing excess liquidity, emergency levels of liquidity last year, long after the emergency had passed in the economy?” Miller Tabak Equity Managing Director Matt Maley says on factors to consider. https://t.co/BATXCjS9rh"
2022-01-18 15:34:31+00:00,c,.@ines_ferre breaks down sector action around $GS $RIVN and $ATVI. Full comments: https://t.co/Ki1GNmTZxP
2022-01-18 15:31:49+00:00,c,Creator who worked with Beyonce wants 'a metaverse your grandmother can understand' https://t.co/chzdUn7hby by @Jenniferisms https://t.co/0c6ZPoxs69
2022-01-18 15:26:26+00:00,c,"“Going back further, they’re accusing the Kohl’s board of not entertaining proposals to take the company private,” @BrianSozzi says on comments from $KSS activist-investor. “Really an attack against the company that’s already under attack by another activist, Engine Capital.” https://t.co/ynuIMFRmQi"
2022-01-18 15:13:55+00:00,c,"“Basically what he was saying… is you can have capitalism and have appreciation for other stakeholders besides shareholders,” Yahoo Finance Editor-in-Chief @serwer says on BlackRock CEO Larry Fink. Full comments: https://t.co/dIawem8934"
2022-01-18 15:13:30+00:00,c,16 unloved stocks ripe for a rally: Bank of America https://t.co/uzGCI3nY0k by @BrianSozzi https://t.co/oZIxlt5qS0
2022-01-18 15:00:58+00:00,c,"$GPS stock drops after getting downgraded to an “underweight” evaluation by Morgan Stanley, $SQ continues to slide after its 52-week low, and $GS shares dip. Full comments: https://t.co/jxg9TC94Pg"
2022-01-18 14:54:49+00:00,c,"The Dow has fallen over 300 points. @SPYJared helps break down the market action, highlighting the tech, software, and financial sectors. Full comments: https://t.co/ogbV4oy6fd"
2022-01-18 14:50:02+00:00,c,"$ATVI jumps as Microsoft announces intention to purchase the game developer, $EA and $TTWO both up as tighter competition within the video game industry is expected. Full comments: https://t.co/BXO7HufZPO"
2022-01-18 14:44:11+00:00,c,"“It’s a left hand and right hand… by 5-to-1, people say ‘I want more business involvement on climate change, race, diversity, re-skilling,’” @EdelmanPR CEO @richardwedelman says. “We find there’s a big drop in trust in business by Republicans who feel business has gone too far.” https://t.co/RjTtgmGJCa"
2022-01-18 14:28:32+00:00,c,"Activision Blizzard stock jumps 36% on Microsoft takeover news
 https://t.co/IYP5vKl0EC @ines_ferre https://t.co/M9VZpSvDzB"
2022-01-18 14:27:17+00:00,c,Why Apple is a $200 stock: Deutsche Bank https://t.co/RurWrmvFMf by @BrianSozzi https://t.co/TwqyKFqmlz
2022-01-18 14:26:50+00:00,c,"“Not as bad as year-over-year drops seen by the other banks, but take a look at equities at $2.12 billion that was down 11%,” @bcheungz says on $GS. “The banks saying they're challenging market-making conditions, big reason why you’re seeing Goldman Sachs selling off."" https://t.co/GwZR9ZyRNt"
2022-01-18 14:19:29+00:00,c,"In the $MSFT 2021 shareholders meeting, “they said the prior year they saw gaming revenue exceed $15B… as many as 33 billion hours played across various platforms,” @DanielHowley says on Microsoft’s purchase of $ATVI. “Activision Blizzard came in with $8.1B for overall revenue.” https://t.co/uDWKS3D9Wz"
2022-01-18 14:18:06+00:00,c,Trump (in October 2021) on a 2024 GOP primary vs. Ron DeSantis: 'I'd beat him like I would beat everyone else' https://t.co/VwgoJnzIZt https://t.co/S2tZHpscCy
2022-01-18 11:31:55+00:00,c,"Supreme Court, Credit Suisse ouster reveal COVID-19 mandate chaos: Morning Brief
https://t.co/U5qPI2f2Jo by @TeflonGeek https://t.co/Ln7d3e48cn"
2022-01-18 07:00:00+00:00,c,"Nearly $100 billion in Covid relief funds have been stolen by criminals, according to the Secret Service: https://t.co/XmNLo4mR7P"
2022-01-18 02:00:01+00:00,c,"JetBlue cancels over 1,000 flights through mid-January due to Omicron: https://t.co/aHLiTgNlrN"
2022-01-18 00:11:45+00:00,c,"Earnings season in full swing, Fed blackout period: What to know this week
https://t.co/zmsgPfm3dM by @alexandraandnyc https://t.co/vDHo4OKck2"
2022-01-17 22:00:00+00:00,c,"MicroStrategy bought another 1,914 Bitcoin, with total holdings now worth $5.9 billion. https://t.co/DO30ayC4Po"
2022-01-17 19:00:02+00:00,c,Ethereum core developer Lane Rettig: “I don’t think there’s any area of our lives that it’s not going to touch.” https://t.co/gZTFHwl2Fq
2022-01-17 15:41:37+00:00,c,Something to keep in mind as Omicron disrupts U.S. businesses https://t.co/jRci0zz4KC via @SamRo https://t.co/LleeXIfmPk
2022-01-17 15:00:03+00:00,c,"This giant Sri Lankan sapphire could be worth $100,000,000. https://t.co/eKm0kMIfMD"
2022-01-17 13:48:25+00:00,c,Labor Secretary on Amazon union vote: Workers ‘should be able to organize without any interference’ https://t.co/6jrjQ4oszP by @serwer and @MaxZahn_ https://t.co/wx6jcqdSLP
2022-01-17 10:00:00+00:00,c,"Iran is banning crypto-mining until March 6, 2022: https://t.co/DbyWDKQiKe"
2022-01-17 09:06:37+00:00,c,Amazon is 'hunting three big whales in its retail business': analyst https://t.co/lqSNN9Q6MQ by @DanielHowley https://t.co/42yx9OOUDK
2022-01-17 07:53:50+00:00,c,Why Omicron is a bigger market risk in 2022 than people think https://t.co/98eiJjDTlW by @SPYJared https://t.co/hllk6XTLAr
2022-01-17 02:00:00+00:00,c,"YF asked Dalio just how concerned he is about inflation, the legendary hedge fund manager responded: ""I'm significantly concerned about it. Because the amount of money and credit that has to be produced and is budgeted, it is a large increase."" https://t.co/9JDlhMsHIo"
2022-01-16 22:54:56+00:00,c,Bill banning stock trading by lawmakers more 'fair for everyday people': Retail trader https://t.co/LYsNd3szVT by @ines_ferre https://t.co/x60wK5zJHd
2022-01-16 22:00:01+00:00,c,"Apple officially hit a market capitalization of $3,000,000,000,000, making it the first publicly traded company in history to hit this mark: https://t.co/NVSrtGScj1"
2022-01-16 19:41:59+00:00,c,Omicron threat seen 'as short term' by business leaders: Commerce Secretary https://t.co/lS3oH5vtCG by @benwerschkul https://t.co/Z7ggXjK70t
2022-01-16 16:29:37+00:00,c,UK government to cut funding for BBC: Mail on Sunday report https://t.co/IIIHMlW31Z https://t.co/liVkH3lPe9
2022-01-16 16:26:04+00:00,c,Tesla inks deal to get key battery component outside China https://t.co/3b8hlmGW2c https://t.co/cjresy0SHI
2022-01-16 16:06:35+00:00,c,"Klay Thompson, Trevor Lawrence among growing list of athletes accepting Bitcoin https://t.co/AskMPK7rPw by @IFanusie https://t.co/mTFeHDUsuM"
2022-01-16 15:30:32+00:00,c,"$15 minimum wage opposition 'doesn't make any sense to me,' Labor Secretary Walsh says https://t.co/KuoBhaQg6t by @adrianambells https://t.co/O3rlNohK92"
2022-01-16 15:07:58+00:00,c,"Omicron: Any COVID-19 variant 'is severe' for unvaccinated populations, doctor explains https://t.co/Oss76wZjpQ by @adrianambells https://t.co/dCU6ISNQDm"
2022-01-16 15:00:01+00:00,c,FTX is the official crypto and NFT platform for the Golden State Warriors🏀 https://t.co/NsfOLu9Yko
2022-01-16 10:32:44+00:00,c,‘Bitcoin is absolutely a tool for social justice’: ex-government regulator turned crypto adviser https://t.co/w9t69Ih15j by @theMarquiseF https://t.co/Mk76j9wDFy
2022-01-16 10:00:01+00:00,c,"Sports giant Fanatics acquired Topps for $500,000,000: https://t.co/UP5QIXbcq1"
2022-01-16 09:03:15+00:00,c,"'Scream' hopes to provide box office jolt as 2022 theatrical risks, Omicron loom https://t.co/1hjHJ31gLK by @alliecanal8193 https://t.co/UTlKcOp3Nc"
2022-01-16 08:18:41+00:00,c,Starbucks unionization doesn’t surprise the US Labor Secretary — here’s why https://t.co/PfthEeKSZK by @MaxZahn_ and @serwer https://t.co/HRhqYgbG1E
2022-01-16 07:55:31+00:00,c,"Even with the Supreme Court loss, Labor Secretary says ‘most companies have stepped up' on mandating vaccines https://t.co/cz9Nault2g by @benwerschkul https://t.co/RrajvRF73q"
2022-01-16 07:32:52+00:00,c,Diverse Federal Reserve nominees tapped for top roles at central bank https://t.co/zosk5N0zYf by @bcheungz https://t.co/dLeEaT7Ez4
2022-01-16 07:00:01+00:00,c,This BMW changes color! https://t.co/3qLirV4ovK
2022-01-16 06:21:10+00:00,c,Americans are 'going all out' on travel this year to make up for lost time https://t.co/5YhxdL76XV by @veragibbons https://t.co/nFRJ13sdqt
2022-01-16 05:55:14+00:00,c,This week in Bidenomics: Flameout https://t.co/RYFn6wSVBl by @rickjnewman https://t.co/s25p7GJBdp
2022-01-16 04:55:03+00:00,c,Price increases ‘not standing in the way of demand’: BlackRock https://t.co/qCzvuPYzXb by @IFanusie https://t.co/AWja5xFIrU
2022-01-16 04:34:15+00:00,c,From the Newmaverse: Tales of terrible bosses https://t.co/2AgM0GJfza by @rickjnewman https://t.co/orI9GLyVQX
2022-01-16 04:04:55+00:00,c,JPMorgan CEO projects up to seven rate hikes in 2022 https://t.co/q0OxNGQwWh by @alexandraandnyc https://t.co/zs4tgthlSG
2022-01-16 03:02:25+00:00,c,Here's how to switch up your career without quitting your job https://t.co/DY0bRSTRp8 https://t.co/Ysy8Zt7edr
2022-01-16 02:37:06+00:00,c,3 reasons why you should invest in love https://t.co/9fydjkrzsZ by @BrianSozzi https://t.co/eIr9PCCKZV
2022-01-16 02:11:48+00:00,c,Snowflake CEO: why you must declare war on your rivals https://t.co/mo78wC2ze3 by @BrianSozzi https://t.co/2lrL0RQ2Os
2022-01-16 02:00:00+00:00,c,Pfizer CEO: “We are working on a new version of our vaccines… that will cover Omicron as well.” https://t.co/OWHdc18tVz
2022-01-16 01:51:13+00:00,c,Inflation has 'direct correlation' with America's chip shortage: Commerce Secretary https://t.co/rAMGYfxzdp by @benwerschkul https://t.co/sp9yIIeEcQ
2022-01-16 00:24:31+00:00,c,Big banks ready themselves for Fed rate hikes — which could be good and bad https://t.co/P9BZsGqRxb by @Bcheungz https://t.co/Uqy54sINXv
2022-01-16 00:03:23+00:00,c,"Lael Brainard, picked for No. 2 Fed spot, pledges to use 'powerful tool' on inflation https://t.co/3yT2MWrjLC by @bcheungz https://t.co/nMuquEmZ28"
2022-01-15 23:17:33+00:00,c,Kazakhstan bitcoin miner: US will make up 60% of the world’s computing power in 2 years https://t.co/Cs0XtRzS4Y by @AkikoFujita and @DsHollers https://t.co/5nRSySuvTQ
2022-01-15 22:56:24+00:00,c,Why the supply chain crisis is an inflationary 'wild card' for the Fed https://t.co/dqgyLrUJ9E by @daniromerotv https://t.co/600UAtgxWn
2022-01-15 22:35:58+00:00,c,"Omicron wave challenging since 'we have less staff,' emergency medicine doctor explains https://t.co/foMk8BQwgK by @adrianambells https://t.co/hDR07OSjVj"
2022-01-15 22:11:12+00:00,c,"Investor: Stocks on a 'wild ride' as investors reprice inflation, Fed hikes https://t.co/jJ6aKScSkF by @IFanusie https://t.co/pNqaOSezqJ"
2022-01-15 22:00:00+00:00,c,Shark Tank Investor Kevin O’Leary discusses the volatility in tech: https://t.co/3xKxB4UDP8
2022-01-15 21:47:22+00:00,c,Who still thinks members of Congress should be able to trade stocks https://t.co/R9AN6iCtZt by @serwer and @MaxZahn_ https://t.co/llQrd0jEFm
2022-01-15 21:26:31+00:00,c,Goldman Sachs destroys one of the most persistent myths about investing in stocks https://t.co/u5Rmyc7QMw by @SamRo https://t.co/UgrGxfBaGP
2022-01-15 20:59:40+00:00,c,Why this paint maker is being forced to jack-up prices by 12% on consumers https://t.co/fagogCJuRX by @BrianSozzi https://t.co/YGOwlsfZ39
2022-01-15 20:21:55+00:00,c,3 mega-cap tech stocks that will gain big as interest rates rise: analyst https://t.co/XpKVcTMcTQ by @BrianSozzi https://t.co/wdfcTwsgc0
2022-01-15 19:54:33+00:00,c,Senator on regulating stock trades by Congress members: 'Full disclosure is absolutely essential' https://t.co/by58OeJe42 by @adrianambells https://t.co/NrCMcFNCz8
2022-01-15 19:31:13+00:00,c,Centene maintains earnings forecast amid Medicare Advantage competition https://t.co/KbjwxUm6H8 by @juleshyman https://t.co/CL7wr4wtJu
2022-01-15 18:44:18+00:00,c,"Private equity sees record $1 trillion year, boosted by rush of COVID-stalled deals https://t.co/THML7yjCZE by @alexandraandnyc https://t.co/cFxZAD7ky5"
2022-01-15 18:23:17+00:00,c,"Omicron: Rise in U.S. hospitalizations 'quite frightening,' doctor says https://t.co/igsF04q9uY by @adrianambells https://t.co/3O9PKcNlNa"
2022-01-15 18:00:37+00:00,c,Netflix raises subscriber prices ahead of earnings https://t.co/FhXzcrg1On by @ines_ferre https://t.co/dZE48GCGUS
2022-01-15 17:36:39+00:00,c,"Tesla stock volatile amid market swings, cybertruck delay, Dogecoin experiment https://t.co/WED6xwkdE2 by @ines_ferre https://t.co/5HUQNodZxw"
2022-01-15 17:14:48+00:00,c,"Block stock hits new 52-week low, getting clobbered since rebrand https://t.co/3J8ghyoeIO by @ines_ferre https://t.co/vMjpF5JjU3"
2022-01-15 16:52:30+00:00,c,China's Xi calls for measures against 'unhealthy' development of digital economy https://t.co/KwksmqZAdA https://t.co/kdGB2PlcmO
2022-01-15 16:31:05+00:00,c,Glaxo rejects $68 billion Unilever bid for consumer business https://t.co/6AklHBl78N via @business https://t.co/smOVkVfpPm
2022-01-15 16:30:19+00:00,c,DirecTV to drop far-right channel OAN from its service https://t.co/cGPntpUeo3 https://t.co/r7rgo6Q2ZS
2022-01-15 16:05:31+00:00,c,AT&amp;T leads bidders in $22.5 billion U.S. spectrum auction https://t.co/FVSwcLUGNr https://t.co/l62xzT4Bwr
2022-01-15 15:00:01+00:00,c,This NFT features 100 digital Birkin-inspired bags: https://t.co/8vJIrYPWDU
2022-01-15 14:02:11+00:00,c,Investing: Goldman Sachs destroys one of the most persistent myths about stocks https://t.co/aXCbWXb50O via @SamRo https://t.co/tmSbFolfzu
2022-01-15 10:00:01+00:00,c,Kevin O’Leary gives his thoughts on cryptocurrencies and why he compares them to investing in software: https://t.co/kyQhd8REgy
2022-01-15 07:00:00+00:00,c,Moderna CEO Stéphane Bance discusses the creation of a COVID and flu combo vaccine: https://t.co/qxQhgdCsvI https://t.co/znMS4Vszod
2022-01-14 23:00:00+00:00,c,This is what Decentralized Finance (DeFi) really means: https://t.co/w4sIKSQQ3t
2022-01-14 22:16:48+00:00,c,"“Think about how it is if you invest in Tesla or Amazon,” NYCE App Founder @Philip_Michael says. “The rate of return is the same whether it’s somebody that put in $100,000 or $100.” https://t.co/gdiBfF9NIx"
2022-01-14 22:04:34+00:00,c,"“What we’re doing… is the home in the sky concept,” @DezerDev President Gil Dezer says. “It definitely creates the transition between car brand into lifestyle.” https://t.co/7eXia4EzLT"
2022-01-14 22:00:00+00:00,c,WATCH NOW: U.S. Labor Secretary @SecMartyWalsh  joins #Influencers with Andy @serwer https://t.co/ihjwrgvmLQ https://t.co/w2V3D3Yc8k
2022-01-14 21:54:34+00:00,c,"“People with Medicare can take advantage of free testing that’s available through health centers in their communities, pharmacies,” KFF Deputy Director of the Program on Medicare Policy @jcubanski says. “There are options.” https://t.co/ubn7h4KKLO"
2022-01-14 21:42:46+00:00,c,Andretti Acquisition Corp. Co-CEOs @michaelandretti and Bill Sandbrook on Andretti Acquisition Corp. seeking a SPAC merger: https://t.co/ZCBl2GrDEl
2022-01-14 21:38:14+00:00,c,"Shkreli ordered to return $64M, is barred from drug industry https://t.co/CxRfTfnysV https://t.co/dpsF1ifaPX"
2022-01-14 21:26:30+00:00,c,"“What we view as the key driver of the shift to momentum stocks is really this unprecedented liquidity that the Fed was injecting,” @InfraCap CEO Jay Hatfield says. https://t.co/wL0rgFHy2E"
2022-01-14 21:25:11+00:00,c,This week in Bidenomics: Flameout https://t.co/thdgtsoGCl by @rickjnewman https://t.co/6pxNgnDlo3
2022-01-14 21:24:57+00:00,c,Americans are 'going all out' on travel this year to make up for lost time https://t.co/F1KK8LSCWo by @veragibbons https://t.co/hZziFFjUmL
2022-01-14 21:21:23+00:00,c,Netflix raises subscriber prices ahead of earnings https://t.co/b48gmOLVWa by @ines_ferre https://t.co/7W8j38IcVT
2022-01-14 21:08:06+00:00,c,"“We at Booz Allen have been fortunate to see in an increase in our labor,” @BoozAllen Hamilton CFO Lloyd Howell says. “We saw an increase of about 6% year over year… We feel that we’ve got a very strong value proposition for our workforce.” https://t.co/Ecx6gqdKF1"
2022-01-14 20:54:32+00:00,c,"“Mortage rates are likely to continue rising,” @realtordotcom’s Economic Research Manager @GeorgeRatiu says. “The truth is, we’re seeing prices beginning to moderate the stratospheric pace that they sustained in 2021.” https://t.co/Z2jY4Yr4zQ"
2022-01-14 20:42:39+00:00,c,"“The traveling public is going to be look at a very difficult situation come January 19,” @HeliAssoc’s John Shea says. “COVID-19 has already caused a very massive disruption to the airlines… That’s only going to be exacerbated by what we’re looking at with 5G.” https://t.co/OJCNZR9adU"
2022-01-14 20:29:45+00:00,c,"“The number of cases have gone up dramatically,” ICU physician @TraumaDocSF says. “What’s happening even more now, which is really dramatic… The virus is burning through the staff at the hospital.” https://t.co/YfdYnLpwDX"
2022-01-14 20:28:36+00:00,c,Big banks ready themselves for Fed rate hikes — which could be good and bad https://t.co/pVj0HIt6Tx by @Bcheungz https://t.co/7A4ltLyEe4
2022-01-14 20:28:14+00:00,c,Kazakhstan bitcoin miner: US will make up 60% of the world’s computing power in 2 years https://t.co/PaQGAeBjfs by @AkikoFujita and @DsHollers https://t.co/elhtDDASU7
2022-01-14 20:27:36+00:00,c,"'Scream' hopes to provide box office jolt as 2022 theatrical risks, Omicron loom https://t.co/gVX9lTKVcp by @alliecanal8193 https://t.co/ESxsaWxoNy"
2022-01-14 20:17:52+00:00,c,"“You can’t talk about these retail sales without talking about the elephant in the room,” Bruderman Asset Mgmt. Equity Analyst Akshata Bailkeri says. “The Omicron variant is one of the main factors affecting the lower sales levels.” https://t.co/hh1f69xHTQ"
2022-01-14 20:11:22+00:00,c,"""Climate is not something that fiscal or monetary policymakers can avoid,"" CEA Member @HBoushey46 says. ""The climate is changing and with it, we need to make sure that our policy toolbox... is taking into account the risks climate change is bringing."" https://t.co/3aGsiYo4be"
2022-01-14 20:00:14+00:00,c,"U.S. Hispanic Business Council CEO @JPalomarez on why his organization agrees with the Supreme Court blocking Biden's vaccine mandate for private employers: ""While we certainly appreciate all of the effort of the White House... this was just a bridge too far."" https://t.co/jo1OGP7d8I"
2022-01-14 19:54:29+00:00,c,"The headwind for banks ""is that the economy does appear to be slowing,"" Sizemore Capital Mgmt CIO @CharlesSizemore says. ""We saw that in the retail sales data today... But the tailwind, what should help the banks, is the rising interest rate environment."" https://t.co/Jb7k9tf4PH https://t.co/D6wzwbCxXK"
2022-01-14 19:32:58+00:00,c,"Private equity sees record $1 trillion year, boosted by rush of COVID-stalled deals https://t.co/zlxmgI47aa by @alexandraandnyc https://t.co/KYLpgeQjD0"
2022-01-14 19:29:53+00:00,c,".@SothebysRealty CEO and President Philip White on the current state of the luxury real estate market:

https://t.co/Jb7k9tf4PH https://t.co/WqzeF2yHhr"
2022-01-14 19:14:25+00:00,c,"""What [we're] observing right now, and I would say for the last four weeks, is a massive slowdown in dining,"" Happy Cooking Hospitality CEO Gabe Stulman says. ""We're seeing that as a direct result of omicron... because some of our staff... are still contracting the virus."" More: https://t.co/YUF6Cd6Tyc"
2022-01-14 19:03:13+00:00,c,"""We have so many staffing shortages across the country,"" Harvard Medical School Professor @AliRaja_MD says, adding: ""The fact is with Omicron and the number of breakthrough cases that we have with it, even our fully vaccinated and boosted staff is getting sick."" https://t.co/0L5qN5Ct9d"
2022-01-14 19:00:02+00:00,c,Why U.S. Labor Secretary @SecMartyWalsh says the U.S. must be “a lot more intentional” with  addressing Black unemployment. WATCH Secretary Walsh’s full #Influencers interview now: https://t.co/ihjwrgvmLQ https://t.co/NixwU88jWv
2022-01-14 18:41:20+00:00,c,"""Overall we do like the financial area because of the inflationary environment, and these companies are able to pass along cost increases associated with interest rate hikes,"" ERShares COO Eva Ados says. https://t.co/Jb7k9tf4PH https://t.co/DIxluNfDYO"
2022-01-14 18:39:12+00:00,c,Snowflake CEO: why you must declare war on your rivals https://t.co/hSJNas92M0 by @BrianSozzi https://t.co/qVQARyHrmj
2022-01-14 18:37:50+00:00,c,"“This, I think, was a shock because of how off the estimates were,” Wall Street Horizon VP of Research @ChristineLShort says about the retail sales numbers. “It’s actually much lower than we were anticipating in December.” More: https://t.co/0xaWFR0Bqn"
2022-01-14 18:26:44+00:00,c,Why this paint maker is being forced to jack-up prices by 12% on consumers https://t.co/zSyfjGdZNK by @BrianSozzi https://t.co/vEZEtMFfDX
2022-01-14 18:21:01+00:00,c,Diverse Federal Reserve nominees tapped for top roles at central bank https://t.co/cBZjamCRTq by @bcheungz https://t.co/MLCcGFJcqc
2022-01-14 17:54:27+00:00,c,Starbucks unionization doesn’t surprise the US Labor Secretary — here’s why https://t.co/NfpyvBhlJL by @MaxZahn_ and @serwer https://t.co/JveJz5hbRv
2022-01-14 17:52:57+00:00,c,"Tesla stock volatile amid market swings, cybertruck delay, Dogecoin experiment https://t.co/7YSQLRgwJS by @ines_ferre https://t.co/69WpYiIhfY"
