date,identifier,tweets
2022-01-05 22:03:24+00:00,c,"“There are smart technologies the Axiom Helmet will come… standard with — Insight which is an impact sensing technology,” @RiddellSports Senior VP of Research Thad Ide says. “It will allow coaches to use data… to better protect their players, to reduce head impact exposure.” https://t.co/ah6UdU2faO"
2022-01-05 21:46:56+00:00,c,Small caps ‘have an edge’ over large caps in 2022: Strategist https://t.co/dVkUPi9znz by @thomashumTV https://t.co/xa1gncVp15
2022-01-05 21:38:33+00:00,c,"Block stock hits new 52-week low, down 26% since Square rebrand https://t.co/l1BhvYlf4j by @ines_ferre https://t.co/1oSPjWd9CJ"
2022-01-05 21:36:27+00:00,c,COVID-19 home tests: Where to find these in-demand products https://t.co/hLyD4tj6X5 by @AnjKhem https://t.co/hmGU6eRhWF
2022-01-05 21:35:02+00:00,c,"“A lot of those young adults now are not transacting on credit cards anymore,” @creditsesame GM of Credit Services Shazia Virji says, adding: ""They’re looking for other means of borrowing and buy now, pay later has been that alternative solution for them.” https://t.co/cAq7V6h9vz"
2022-01-05 21:25:00+00:00,c,"“1.77 was the high for all of last year… if we break through that, we enter a new regime where rates have to find a new balancing act and that’s going to create more volatility,” @WellsFargo CIO of Wealth &amp; Investment Darrell Cronk says on T-Note yields. Full comments: https://t.co/kwE8s6zg7P"
2022-01-05 21:14:44+00:00,c,"“Athena was born out of that necessity to continue to increase the number of women in capital markets, but what was most important was to make sure that our talent was second to none,” Athena Technology’s Founder Isabelle Freidheim says on the group’s SPAC deal. Full comments: https://t.co/2JUI68KMqp"
2022-01-05 21:01:59+00:00,c,"Stocks drop, tech shares sink after Fed minutes hint at earlier liftoff on interest rates: Nasdaq slides by 3.3% https://t.co/nCuWoPeIw4 by @emily_mcck https://t.co/DqOOFcOGkF"
2022-01-05 20:57:21+00:00,c,".@FiskerInc Chairman and CEO @henrikfisker on new EV Ocean: “We are sticking to a target starting price of $37,499. That’s before the tax credit you receive from the federal government which makes it $29,999 and that’s a pretty cool SUV to get for that price.” https://t.co/bbPZN2mnPe"
2022-01-05 20:54:50+00:00,c,"Pilot union cheers 5G delay, calls on AT&amp;T, Verizon to heed industry, FAA concerns https://t.co/Czk7vYeV5r by @mikejuangnews https://t.co/yxG7OW8HHA"
2022-01-05 20:36:18+00:00,c,"“The president of El Salvador has made some interesting predictions… that sometime this year we’ll see a six-figure bitcoin,” @CoinDesk Learn Editor @ollieleeech says. “But a couple of people are also saying we might be in for a bearish year.” https://t.co/QWG3qdsBJI"
2022-01-05 20:27:13+00:00,c,"“Testing at the first time you have symptoms, that’s really the most important time to test,"" University of Michigan’s Dr. @Payal_Patel says on CDC guideline confusion. ""At five, seven, or ten days, the test is not quite able to tell you if you're still infectious or not."" https://t.co/6Igj2noRZh"
2022-01-05 20:17:40+00:00,c,"“I’m not sure that the market sell-off today is… directly caused by the [FOMC meeting] minutes,” @CAPTRUSTfa CIO Michael Vogelzang says on the Fed. “This is a continuation of what we’ve been seeing over the last six weeks really as growth stocks have lost their leadership.” https://t.co/n4PJ10IU1I"
2022-01-05 20:00:15+00:00,c,"“Gold to me is an underrated asset right now,” InTheMoneyStocks President &amp; CFO @GarethSoloway says. “I actually have it beating the S&amp;P 500 as well as bitcoin for this year. … Bitcoin and cryptocurrencies are going to see their dot com moment over the next year or two.” https://t.co/i5PO10AztZ"
2022-01-05 19:54:58+00:00,c,"Jobless claims preview: Another 195,000 Americans likely filed new claims last week https://t.co/8LruH4R5Zl by @emily_mcck https://t.co/WWwns85t4K"
2022-01-05 19:51:08+00:00,c,"“Investors have been getting into these ESG ETFs, these dual impact ETFs, for a variety of reasons,” New York Life's Wendy Wong says. “Could be a way to tiptoe into the ESG market, ... a way to reflect their beliefs in their portfolio... and a way to diversify their funds.” https://t.co/i6qyUVhsOl"
2022-01-05 19:39:32+00:00,c,"“Markets are probably looking forward to the midterm elections because it’s going to glue up the gears of government a little bit more,” @DLineCap Founder Jeffrey Gundlach says. Full comments: https://t.co/9txSY6n3Ko"
2022-01-05 19:38:54+00:00,c,"NFTs “went from ‘I don't know what an NFT is’ to ‘it’s worth $70 million,’” @DLineCap Founder Jeffrey Gundlach says. “That’s certainly not for me. That’s for momentum investors on large doses of steroids.” Full comments: https://t.co/6UNJDO7E5D"
2022-01-05 19:35:16+00:00,c,"“Bitcoin is for speculators,” @DLineCap Founder Jeffrey Gundlach says. “At the present moment, I would advise against bitcoin. … Maybe you should buy it at $25,000.”

https://t.co/Jb7k9tf4PH https://t.co/amCQjlty9U"
2022-01-05 19:34:38+00:00,c,"WonderFi CEO @bensamaroo on acquiring Bitbuy: “We believe this is actually the biggest crypto acquisition in Canadian history, so it’s a really big step forward for the Canadian market.” https://t.co/BUFNnY8XsZ"
2022-01-05 19:24:26+00:00,c,"“The Fed is really trying to fulfill both of its mandates now,” ADP Chief Economist @NelaRichardson says. “They’re basically driving two cars at this point. They’re behind both wheels.” Full interview: https://t.co/GuNwt5igtj"
2022-01-05 19:23:41+00:00,c,Roku drops amid underweight analyst initiation https://t.co/LiaFnM1bCo by @ines_ferre https://t.co/snV7BhEpiR
2022-01-05 19:17:41+00:00,c,"December FOMC meeting minutes have been released.

“A couple of participants on the committee appear to express concerns about the unanchoring of inflation expectations,” @bcheungz says, but a majority “appear to be OK with these hot readings.” https://t.co/pt5sVs2IoL"
2022-01-05 19:05:49+00:00,c,"GM, Chrysler, Mercedes, and Sony announce new electric vehicle models. @danielhowley breaks down the latest reveals at CES 2022: https://t.co/Mh0Nmz800b"
2022-01-05 18:57:39+00:00,c,Personal finance expert Jean Chatzky explains the top five tips for improving your financial health in 2022: https://t.co/8ONrIImhZK
2022-01-05 18:42:03+00:00,c,"“There is less business opposition right now to raising the minimum wage than I’ve ever seen,” National Employment Law Project's @paulsonn says. “It’s really kind of ideological politicians… that are bottling this up, and they’re really just hurting their own constituents.” https://t.co/PkBcP98Sl6"
2022-01-05 18:31:53+00:00,c,"“We need to really be looking at what we know still works,” Johns Hopkins Biocontainment Unit medical director Dr. Brian Garibaldi says about the Omicron spread. Kids, “even those who are vaccinated, they should be wearing masks in schools right now.” Full interview: https://t.co/LLchK2maM7"
2022-01-05 18:29:18+00:00,c,Volvo to debut self-driving feature in California using Luminar sensor https://t.co/ABHQ63JVMk https://t.co/A72VX57SoU
2022-01-05 18:19:36+00:00,c,"“The primary piece of the puzzle… is the Fed,” Zephyr Market Strategist @LkTahoeBadger says. “Markets don’t really react too greatly to when the Fed starts hiking rates — it’s the pace.” 

https://t.co/Jb7k9tf4PH https://t.co/QW4Sh0rnmo"
2022-01-05 17:53:26+00:00,c,GM unveils Silverado EV pickup at CES https://t.co/nrD5Xq0WhO by @Pras_S https://t.co/U32GvVW8F2
2022-01-05 17:44:37+00:00,c,"“Yes, we should help sell and convey vaccines to the world, but we should also help the group of international nations build production capacity to address both this, future mutations, and future viruses that might come along,” @senjeffmerkley says. https://t.co/jK9LiMEyBr"
2022-01-05 17:44:09+00:00,c,NFTs are for momentum investors on large doses of steroids: bond king Jeffrey Gundlach https://t.co/3VEA5Gf9dl by @BrianSozzi https://t.co/nN7SCKUc5L
2022-01-05 17:41:54+00:00,c,"“Products of forced labor… should not be ones we allow into our country,” @senjeffmerkley says about the forced labor allegation concerns in China. “We cannot be complicit in that slavery by buying those products. That’s a very clear human rights line.” https://t.co/LWV5zSxozD"
2022-01-05 17:41:10+00:00,c,"“The list of things that are done to the Uyghur population, their muslim population inside china, is just horrific,” @senjeffmerkley says. “We’re taking about cultural genocide, but we’re also talking about strategies to prevent reproduction.” https://t.co/PR6LgOYMK8"
2022-01-05 17:37:17+00:00,c,"Marriott International President Stephanie Linnartz discusses the launch of their design lab, business recovery, and more: https://t.co/uNIEod72c5"
2022-01-05 17:34:53+00:00,c,"“The way we think about China, is it it’s a really important market for travel… as an outbound market,” Marriott International President Stephanie Linnartz says. More: https://t.co/SCpDmsUIr1"
2022-01-05 17:30:00+00:00,c,LIVE NOW:@senjeffmerkley joins Yahoo Finance for an interview. Watch at https://t.co/EFM2cRZeTQ! https://t.co/KctbU1CU50
2022-01-05 17:20:53+00:00,c,"“Beginning of the year we’re already seeing the cyclical trade outperform but… I don’t think you can read into that too much,” Payne Capital Management President @RyanPaynePCM says. “But, what I think what actually is significant, is the way the bond market is moving.” https://t.co/XmUJoJBfrf"
2022-01-05 17:17:51+00:00,c,"“It’s pretty clear that there are more paper promises to bitcoin than there are actual bitcoins,” Avanti Financial Group CEO and Founder @CaitlinLong_ says. More: https://t.co/Ji89KsmwCH"
2022-01-05 16:52:41+00:00,c,"Samsung Heard of Product, marketing, TV Lydia Cho and Samsung Dir. of Product Planning, TV Dan Schinasi discuss the company’s latest TV products: https://t.co/RV5tmqhcj2"
2022-01-05 16:49:20+00:00,c,Wayfair shares sink after Wedbush note calls its 2021 results 'underwhelming' https://t.co/rRXcm6lB5V by @ines_ferre https://t.co/c4mimXxJ48
2022-01-05 16:37:35+00:00,c,"“There is some very, very good news,” @NorthwellHealth CEO @MichaelJDowling says. “While our numbers have increased… it seems to be flattening a little bit over the last couple of days. The good news is that people are not as sick as they were before."" Full interview: https://t.co/9PlR074BcI"
2022-01-05 16:16:17+00:00,c,"“2022, we are still constructive on markets,” Citi Global Wealth Investments in North America Head Kristen Bitterly says. “We believe the expansion is going to continue, but it’s simply not going to be as easy.” More: https://t.co/0wVunNVKJ7"
2022-01-05 16:15:05+00:00,c,"""The bond market is already showing enough of a recession indicator that by 2023, it seems pretty likely,"" Jeffrey Gundlach says. ""I don't think a lot of Fed officials and economists and investors appreciate the fact the economy keeps buckling at lower and lower interest rates."" https://t.co/disIOxxJns"
2022-01-05 16:10:51+00:00,c,"Coming up, @senjeffmerkley joins Yahoo Finance LIVE to discuss how lawmakers are addressing concerns over forced labor allegations in China. Watch at https://t.co/EFM2cRHE2i! https://t.co/lfk0Ps5XU0"
2022-01-05 16:05:52+00:00,c,"""Automotive is going through significant modernization and over the next decade, we expect automakers to be really transforming their products significantly,"" @Qualcomm SVP and GM of Automotive @NakulDuggal says. https://t.co/Jb7k9tf4PH https://t.co/TSU3DxXIOR"
2022-01-05 15:52:34+00:00,c,"""A lot of businesses [are] struggling because a lot of the workers dropped out earlier last year,"" JPMorgan's Jim Glassman says, adding that with many expired unemployment programs, ""my guess is over the course of this year, we're going to see those folks come back in."" https://t.co/zvnXoWWgRh"
2022-01-05 15:44:14+00:00,c,"SGH CEO Mark Adams on the company's Q1 earnings beat, its two-for-one share split, and the global microchip shortage:

https://t.co/Jb7k9tf4PH https://t.co/bTzSHHeMM3"
2022-01-05 15:40:23+00:00,c,"Sony could enter EV market, shares pop https://t.co/xsp3ZJQCfn by @ines_ferre https://t.co/Rls2M9ZAhE"
2022-01-05 15:14:54+00:00,c,Why an online ticket platforms considers Netflix its competition https://t.co/EfAge1XDlY by @MaxZahn_ and @serwer https://t.co/EzhP6sclkT
2022-01-05 15:14:25+00:00,c,Bitcoin is for speculators right now: bond king Jeffrey Gundlach https://t.co/7DXGcNNDEH by @BrianSozzi https://t.co/YEK1iaJeWS
2022-01-05 15:08:47+00:00,c,"""We still think there's room for the dollar to strengthen further,"" MUFG's Lee Hardman says. ""The main catalyst for the dollar strengthening towards the end of [2021] was the aggressive repricing of Fed tightening expectations, and we think that... will continue early this year."" https://t.co/FCB6kvaY4s"
2022-01-05 14:44:35+00:00,c,"""The way things are going it seems pretty likely we're going to get a 7-handle on the CPI soon,"" @DLineCap Founder Jeffrey Gundlach says. ""But the CPI, of course, is a strange construct..."" https://t.co/Jb7k9tf4PH https://t.co/zBdHCWtB36"
2022-01-05 14:41:14+00:00,c,"""My guess is that the recessionary signal will be that the yield curve may flatten significantly below two,"" @DLineCap Founder Jeffrey Gundlach says. ""You might actually get very little movement up… and the Fed will follow."" https://t.co/Jb7k9tf4PH https://t.co/tPg60vKmwq"
2022-01-05 14:32:50+00:00,c,"""What's happening is the yield curve is sending a bonafide recessionary signal,"" @DLineCap Founder Jeffrey Gundlach says. ""You have interest rates going up at the short end and going down at the long end. That's the one investors really have to watch out for."" https://t.co/HslPnNkA8g"
2022-01-05 14:26:49+00:00,c,"""The CDC was getting a lot of pushback after it changed its guidelines to allow individuals to get out of isolation after five days and then continue to wear masks for the remaining five days,"" @anjkhem says. More:

https://t.co/Jb7k9tf4PH https://t.co/FSMqck69h0"
2022-01-05 14:09:33+00:00,c,"Riddell launches Axiom, latest helmet to combat concussions https://t.co/Ue7hjK1JSh by @_JoshSchafer https://t.co/FAJ92UyuYH"
2022-01-05 13:18:23+00:00,c,"December private payrolls rose by 807,000, far exceeding expectations: ADP https://t.co/Y3pPzehDok by @emily_mcck https://t.co/4smIvxvrk1"
2022-01-05 11:49:47+00:00,c,"'China is uninvestable,' says Bond king Jeffrey Gundlach https://t.co/ndPigR7Djv by @BrianSozzi https://t.co/RZJ06MtyBE"
2022-01-05 11:36:04+00:00,c,"What JOLTS says about the jobs market – and everything else: Morning Brief
https://t.co/pCi4A77elo by @TeflonGeek https://t.co/Sb1tYXNhMX"
2022-01-05 00:55:33+00:00,c,Tencent sells $3.01 billion stake in Singapore tech group Sea https://t.co/Wu9zDOB3MU https://t.co/YxevlTgASG
2022-01-05 00:38:01+00:00,c,KFC to debut Beyond Fried Chicken menu item as plant based boom expands https://t.co/aozXm63SPX by @alliecanal8193 https://t.co/ojOC32sTzf
2022-01-05 00:00:47+00:00,c,Toyota dethrones GM as U.S. sales leader after nearly a century on top https://t.co/L7IUX6IGTt https://t.co/YK7Yqlsty9
2022-01-04 23:30:00+00:00,c,Yahoo Finance Presents: Troy Aikman! Watch the full interview LIVE NOW here: https://t.co/kCSTqTvnvv https://t.co/FigFkuoZ9m
2022-01-04 23:00:01+00:00,c,"Apple officially hit a market capitalization of $3,000,000,000,000, making it the first publicly traded company in history to hit this mark: https://t.co/kTpDhwYFze"
2022-01-04 22:34:17+00:00,c,Tesla showroom in China's Xinjiang region blasted by rights groups https://t.co/GPzXLQnsWY https://t.co/ANmWSCGfBC
2022-01-04 22:30:00+00:00,c,"YF asked Dalio just how concerned he is about inflation, the legendary hedge fund manager responded: ""I'm significantly concerned about it. Because the amount of money and credit that has to be produced and is budgeted, it is a large increase."" https://t.co/cZsyqthCOW"
2022-01-04 22:27:16+00:00,c,From the Newmaverse: This is when Democrats’ social programs die https://t.co/MlTMo7ZQmn by @rickjnewman https://t.co/Lz2fJGRt2j
2022-01-04 22:25:07+00:00,c,Bitcoin's 'Ted Lasso' explains the 'real plan' behind buying a UK soccer team https://t.co/NNWcDRRCqo by @dshollers https://t.co/hMI4BktWZF
2022-01-04 22:23:43+00:00,c,"Elizabeth Holmes likely to face 'double-digit sentence' for fleecing investors, experts predict https://t.co/AwBcbTahcT by @alexiskweed https://t.co/LW5R57VIMp"
2022-01-04 22:05:58+00:00,c,"“What we found… is the employer is often one of the most trusted places for folks to turn to for [financial] information,” @Voya Financial CEO of Wealth Solutions Heather Lavallee says on its survey results. “Very often the employers have had to vet the information.” https://t.co/PAeDLo7hac"
2022-01-04 21:57:08+00:00,c,"“What makes this generation of chips so special is that hybrid architecture where we have high-performance cores and high-efficiency cores in the same product,” @intel Executive VP and General Manager @gregorymbryant says. Full comments: https://t.co/AKNUHc30fg"
2022-01-04 21:52:06+00:00,c,"“It’s going to prevent our pilots from being able to fly low visibility approaches which are going to cause more disruptions,” @ALPAPilots @ALPAPresident Joe DePete says on 5G interrupting various flight instruments and mechanisms. Full comments: https://t.co/NIscEhjTEU"
2022-01-04 21:47:23+00:00,c,"Qualcomm, Microsoft partner on metaverse chip for AR glasses https://t.co/4numH3aJoc https://t.co/JvWKyMIeHj"
2022-01-04 21:40:04+00:00,c,"""There has been lots of discussions about runaway inflation, the Fed being behind the curve — All of that would translate into a long-end 10, 20, 30-year portion of the U.S. yield curve that’s steeper or materially higher,"" @BMO’s Scott Kimball says. Full comments: https://t.co/Jnz3PTW3sM"
2022-01-04 21:25:47+00:00,c,"“The risk is that new variants continuously pop up,” @MorningstarInc Equity Analyst Burkett Huey says on airlines. “These issues that maybe investors are thinking of as more one-time events start being a little bit more cyclical on perhaps either a quarterly or a biannual basis.” https://t.co/6BdBAgHwlT"
2022-01-04 21:07:55+00:00,c,".@Quillintel CEO @DiMartinoBooth on the Fed: “I think that the fiscal stimulus created inflation is something that’s largely out of the Fed’s control. They’re not used to that for the past few generations, let’s say, since [Alan] Greenspan when rates were really coming down.” https://t.co/FMOwAPivES"
2022-01-04 20:49:58+00:00,c,"“FTX has been running ads with Tom Brady for months,” @decryptmedia Editor-in-Chief @readDanwrite says on crypto. ""Sometimes there’s a patient zero on Twitter — It just takes one or two big influencers with a huge following discovering something to bring it back to the fore.” https://t.co/iJMY2G20XB"
2022-01-04 20:33:37+00:00,c,Pinterest shares sink amid Guggenheim downgrade https://t.co/Gi6lJHTkIm by @ines_ferre https://t.co/OimAUg8zZJ
2022-01-04 20:27:58+00:00,c,"“Kids’ airways are not adult airways, this variant is also different than the first time around,"" Nurse Practitioner Dr. @AskTheNP says. “We have to think about this from a volume standpoint… we’re seeing more kids in emergency departments… that are not pediatrician-focused.” https://t.co/kP9wg3ZPXe"
2022-01-04 20:18:52+00:00,c,".@Oxbow_Advisors Managing Partner Ted Oakley says on the Fed: “Mainly, I think what’s happened with the Fed is they turned political on us… as soon as the inflation numbers had gone up, and I think the administration had pressed them to... not worry as much about the market."" https://t.co/q7lMM26Mpi"
2022-01-04 20:06:26+00:00,c,Taste test: @BrookeDiPalma tries Turkey Hill’s new mystery flavor: https://t.co/pYcM9UD8ck
2022-01-04 20:01:27+00:00,c,"“We’re really accelerating what’s achievable in our product lines by reimagining laptop design for repair, reuse, and recycling,” Dell Technologies' Rahul Tikoo says. “Concept Luna really moves the needle forward in really reducing the carbon footprint of laptops by almost 50%.” https://t.co/XJZ9qBAAQe"
2022-01-04 19:54:59+00:00,c,"“This current Omicron wave will eventually subside… then the question is what happens next,” Baylor’s Dr. Peter Hotez says. “We’ll have a break for maybe a few months, and then the next variant will come along unless we make that commitment to vaccinate the world.” https://t.co/6aask5Q41u"
2022-01-04 19:35:46+00:00,c,"“With interest rates going up, it’s not really affecting the issuer,” @DLineCap Portfolio Manager Monica Erickson says. “It’s affecting more the buyer of the debt, the investor in the asset class. Issuers right now are frankly in a very good spot.” Full interview: https://t.co/xLo2j5RPqq"
2022-01-04 19:26:17+00:00,c,Money expert: Here's how to keep those 2022 financial resolutions https://t.co/YlBjfXGyhJ by @bookgirlchicago https://t.co/iW6ZodOaRM
2022-01-04 19:18:56+00:00,c,"“The Federal Reserve has had its thumb on the scales of justice, affecting the price of the 10-year,” @intrepidcapital CEO Mark Travis says. “It definitely dings the valuations of long-duration assets.” https://t.co/Jb7k9tf4PH https://t.co/BuQNAgNyeS"
2022-01-04 19:15:34+00:00,c,Ford shares rise 11% after news of production increase for electric F-150 Lightning pickup https://t.co/nAz2gWL1jQ by @ines_ferre https://t.co/fglPAvkXdk
2022-01-04 18:53:39+00:00,c,"“We’re going to be heading into a slowdown, ... and you have a Fed that’s going to be tightening into that slowdown,” KeyAdvisors Group’s @commonsensebull says. “This increase in rates doesn’t concern me at all. I think it’s going to be short-lived.” Full interview: https://t.co/T8pxwbdmd5"
2022-01-04 18:33:31+00:00,c,"“The very purpose of the workplace has changed,” JLL Work Dynamics Americas CEO @DrSanjayRishi says. “The purpose of the workplace has to be a social hub. … Talent is so portable.” Full interview: https://t.co/relTV30awN"
2022-01-04 18:22:19+00:00,c,"“State policies are often influenced by what the federal policy is,” Health Justice Founder and Executive Director Dr. @oni_blackstock says about COVID-19 guidance. “So we do need to have the federal government modeling and providing that guidance.” Full interview: https://t.co/EouuM2tjCJ"
2022-01-04 18:21:14+00:00,c,"This is the No.1 risk to the stock market right now, according to Jim Bianco https://t.co/UMmqne4HtI by @BrianSozzi https://t.co/jPfg0Gv7qJ"
2022-01-04 18:05:20+00:00,c,Taxes 2022: Here's how to prep for this year's filing season https://t.co/FDlVgIoEMi https://t.co/0UGVmCN3mM
2022-01-04 18:04:54+00:00,c,The biggest trends to expect from CES 2022 https://t.co/vRCiq2VCPf by @DanielHowley https://t.co/QGWrOIWX9h
2022-01-04 18:04:38+00:00,c,Don't expect 'old school' inflation anytime soon: DoubleLine's Jeff Sherman https://t.co/bQ4BUFTW24 by @BrianSozzi https://t.co/HdP3XAPJwr
2022-01-04 18:04:24+00:00,c,Democrats’ most alarming problem https://t.co/GcrTlzPbgP by @rickjnewman https://t.co/dKEkpkbqxr
2022-01-04 17:45:53+00:00,c,'What Bitcoin Did' Host @petermccormack on how and why he bought a local UK soccer club: https://t.co/sF7zF4yQ08
2022-01-04 17:37:14+00:00,c,"“The number one risk right now in 2022... is that the high inflation rate is perceived to be persistent, which pushes the Fed hard to do something about it, and in the process of doing something, it puts the rally of the stock market at risk,” Bianco Research's Jim Bianco says. https://t.co/ObNEiWsiBT"
2022-01-04 17:32:25+00:00,c,"“Unfortunately, the Fed is very good at one thing... that they raise rates until they break something,” Bianco Research President Jim Bianco says. https://t.co/D7QeZxzIEJ"
2022-01-04 17:31:42+00:00,c,"“There’s a lot of money coming into the market, but it’s all getting concentrated in the indexes… in these big cap tech stocks…” Bianco Research President Jim Bianco says. “So yes, money is coming in, but the world of the stock market’s one symbol.” https://t.co/v0rZECmQYa"
2022-01-04 17:21:17+00:00,c,"“I think valuations are going to start to matter a little bit more than they have in the past, and I think that's a positive thing for the market,” Kayne Anderson Rudnick Portfolio Manager and Senior Research Analyst Julie Biel says. https://t.co/3OIfOL6sEk"
2022-01-04 17:18:35+00:00,c,"“The jury's verdict was probably the best possible verdict for the government,” Dickinson Wright's @Jacob_Frenkel says about the Elizabeth Holmes trial. “The conviction was on the fraud counts... which really sets up the judge to impose a high sentence.” More: https://t.co/gQDrpRB0OY"
2022-01-04 17:10:46+00:00,c,Kashkari Sees 2022 Fed rate hikes to counter inflation risk https://t.co/7iu4pnVcCJ via @business https://t.co/9sBYvUGF0m
2022-01-04 17:10:13+00:00,c,"After 90 years on top, GM is no longer the No. 1 automaker in America https://t.co/Y3weec6r27 https://t.co/6kx5bqtQZk"
2022-01-04 17:03:03+00:00,c,"“There’s something like 87 countries exploring a central bank digital currency,” CoinDesk Global Macro Editor &amp; CoinDesk TV Anchor @emilydparker says. “The latest we’ve learned is Mexico.” More: https://t.co/qo36V93xPH"
2022-01-04 17:00:44+00:00,c,"“The whole industry is facing inflation in pretty much every aspect of the business,” Hain Celestial Group CEO Mark Schiller says. “We have a robust productivity agenda… but, given that we’re approaching 10% inflation... we have to pass some of that on to our consumers.” https://t.co/B62arCqkjK"
