date,identifier,tweets
2022-01-28 07:57:43+00:00,c,"Robinhood quarterly revenue misses estimates, stock sinks in after hours
 https://t.co/OlOSF6Ax1d by @ines_ferre https://t.co/woqmoR02Yk"
2022-01-28 07:36:22+00:00,c,Inflation: Seniors struggle with a new era of rapidly rising prices https://t.co/BUg8YkAF4J by @KerryHannon https://t.co/XoCXYqjokP
2022-01-28 07:13:08+00:00,c,"Ackman boosts Netflix, but here's why one bear thinks 'the dream is over' https://t.co/KeuvQLAOsI by @alliecanal8193 https://t.co/dbDjmo1XTm"
2022-01-28 06:51:46+00:00,c,Bentley CEO details $3.4 billion ‘transformation’ for electric vehicle era https://t.co/aKKPPQq5ZH by @Pras_S https://t.co/P8F17r3Pbq
2022-01-28 06:30:51+00:00,c,Why Tesla is building a humanoid robot https://t.co/n21A7URCOi by @graceodonne11 https://t.co/AfODfDdgPj
2022-01-28 06:05:27+00:00,c,Why ServiceNow CEO Bill McDermott doesn't fear higher interest rates https://t.co/zSq2ro5IPU by @BrianSozzi https://t.co/XI0uCZmnld
2022-01-28 05:45:25+00:00,c,"Tesla is disappointing investors because it doesn't have a $25,000 car: analyst https://t.co/6r7AoecmPy by @BrianSozzi https://t.co/Q4U3Msi52I"
2022-01-28 05:23:41+00:00,c,US jobless claims trend down as Omicron disruptions begin to ease https://t.co/gkmPreEAa8 by @alexandraandnyc https://t.co/wFy85VNWN8
2022-01-28 04:58:25+00:00,c,Lucid stock falls after rival Tesla warns about supply chain https://t.co/aJqBYk2IcB by @ines_ferre https://t.co/FJZTiuwvha
2022-01-28 04:33:59+00:00,c,Mortgage rates settle after four weeks of increases https://t.co/QGTlCGXUOd by @WritesRonda https://t.co/VeJT40azEq
2022-01-28 04:09:42+00:00,c,"Q4 GDP: US economy expanded at 6.9% annualized rate, topping expectations https://t.co/vgn79jiEmK by @emily_mcck https://t.co/26TsQrD17T"
2022-01-28 03:40:31+00:00,c,Trump’s Operation Warp Speed ‘very helpful’ for COVID vaccine development: author https://t.co/xUzgsGdi6K by @MaxZahn_ and @serwer https://t.co/HiSFUupWXN
2022-01-28 03:16:32+00:00,c,Tesla stock slide 8% over supply-chain woes and new vehicle delays https://t.co/1MN7UVz1eg by @alexandraandnyc https://t.co/L2dmtKPqBt
2022-01-28 02:52:32+00:00,c,"Bitcoin, crypto reverse post Fed gains, not 'enough reassurance to turn the tide' https://t.co/itleWizD6G by @DsHollers https://t.co/0mGpP6YrcK"
2022-01-28 02:23:07+00:00,c,U.S. House panel to hold hearing on autonomous vehicles https://t.co/yjfndlOmqV https://t.co/pFXhyK3G4K
2022-01-28 01:59:43+00:00,c,3M hit with $110 million verdict in latest U.S. military earplug trial https://t.co/0BScGAEcCE https://t.co/ufiSep6Q5D
2022-01-28 01:29:29+00:00,c,Biogen sells Bioepis stake for $2.3 billion to Samsung Biologics https://t.co/AHz7QG2g6v via @business https://t.co/BmMiMhCpea
2022-01-28 01:20:00+00:00,c,"Visa profit beats quarterly estimates on higher travel, online spending https://t.co/7KWshqc9qt https://t.co/bWhgtoVPUT"
2022-01-27 23:30:00+00:00,c,Cargo theft from freight trains in Los Angeles County have seen a sharp increase during the pandemic: https://t.co/dZKaAtuqcB https://t.co/SQP2dpS5Ao
2022-01-27 23:00:27+00:00,c,"IMF warns crypto rout could lead to systemic risk, backs Fed digital coin https://t.co/KjiBrOJ7kT by @Jenniferisms https://t.co/bJuh4aCEz8"
2022-01-27 23:00:02+00:00,c,These are the crypto tax implications for 2021: https://t.co/Boag5Hmi8H
2022-01-27 22:20:45+00:00,c,Bentley CEO: EV interest from luxury buyers doubled in past 4 years https://t.co/K8CQBcUNHa by @Pras_S https://t.co/6aVhd0JQin
2022-01-27 22:05:23+00:00,c,KeyBanc Capital Markets Managing Director Josh Beck on $HOOD Q4 earnings: https://t.co/CUKdfa2D7h
2022-01-27 22:00:00+00:00,c,WATCH NOW: ‘A Shot to Save the World’ Author and WSJ Special Writer @GZuckerman  joins #Influencers with Andy @serwer https://t.co/3nkDdgggUK https://t.co/JPg2Jgrsn2
2022-01-27 21:53:33+00:00,c,Bentley CEO details $3.4 billion ‘transformation’ for electric vehicle era https://t.co/TDvRPRDGTP by @Pras_S https://t.co/MABzpOJxPf
2022-01-27 21:49:11+00:00,c,D.A. Davidson Managing Director and Senior Research Analyst Tom Forte discusses important takeaways from $AAPL Q1 earnings: https://t.co/B3C8dGpkCa
2022-01-27 21:45:13+00:00,c,Why Tesla is building a humanoid robot https://t.co/bx8cgvXwip by @graceodonne11 https://t.co/DDlsc21zE6
2022-01-27 21:41:23+00:00,c,Apple smashes Wall Street expectations with historic Q1 revenue https://t.co/RautAROzXM by @DanielHowley https://t.co/mjqcit6opa
2022-01-27 21:35:16+00:00,c,"""Where we're still waiting for recovery to manifest itself is on the international side of our business,"" Hawaiian Airlines CEO Peter Ingram says, later adding: ""The rules are changing and that's really hard… We really hope the government will look at maintaining stability."" https://t.co/8bvPmRCMkV"
2022-01-27 21:24:33+00:00,c,Biden aide: 'We have got to do more' to lower the Black unemployment rate https://t.co/PUYzF77UVg by @benwerschkul https://t.co/iwiQSBTfU4
2022-01-27 21:16:11+00:00,c,".@CtrSquare Chief Strategist Scott Crowe on the Fed’: “It wasn’t so long ago they were describing inflation as transitory, but now they have their sights set firmly on moderating inflation… That’s given the market a lot of indigestion.” https://t.co/iY7NYAEB6z"
2022-01-27 21:13:28+00:00,c,"Robinhood quarterly revenue misses estimates, stock sinks in after hours
 https://t.co/O2iqaJym3L by @ines_ferre https://t.co/ITEJSIdIF8"
2022-01-27 20:53:44+00:00,c,"“The Fed is uncertain, as all of we are,” Head of @BlackRock Muni Bonds Group Peter Hayes says. “We don’t know what’s going to happen with the virus, the economic bounceback, the future variants that will derail the economy.” https://t.co/YFiZrhA7yu"
2022-01-27 20:32:59+00:00,c,.@LGVNSocial Co-Founder Dr. Joshua Hare on COVID: “There’s really no way to predict [and] that’s what’s scary… Some have predicted that Omicron is actually the ideal virus because it’s very infectious and it’s not as severe as the earlier strains.” Full comments: https://t.co/XPOr7ptwVY
2022-01-27 20:16:35+00:00,c,"“Our belief is that supply chain issues will be alleviated to an extent later this summer,” @ceteraIM CIO Gene Goldman says, adding: “The Fed is trying to tackle this inflation via supply chain issues… The [economy’s] growth is slowing, but nowhere near pre-pandemic levels.” https://t.co/NcFd0AIqB8"
2022-01-27 20:16:25+00:00,c,Lucid stock falls after rival Tesla warns about supply chain https://t.co/xUnVfZvtw2 by @ines_ferre https://t.co/dr30SWM9aP
2022-01-27 20:04:45+00:00,c,Inflation: Seniors struggle with a new era of rapidly rising prices https://t.co/1fX3TcO9iv by @KerryHannon https://t.co/bGjYQbEmvt
2022-01-27 19:34:18+00:00,c,".@ConstellationR Principal Analyst @RWang0 previews $AAPL earnings:

https://t.co/Jb7k9tfCFf https://t.co/Q7uiVYczfV"
2022-01-27 19:18:17+00:00,c,A few things are going Biden’s way https://t.co/GvUPsoc1DW by @rickjnewman https://t.co/QCzNE0EGYN
2022-01-27 19:11:51+00:00,c,".@HRBlock CEO @jjones on the 2022 tax season and the Child Tax Credit:

https://t.co/Jb7k9tf4PH https://t.co/bUQrKxBaxt"
2022-01-27 19:08:41+00:00,c,"Tesla is disappointing investors because it doesn't have a $25,000 car: analyst https://t.co/jlGwnlbmtp by @BrianSozzi https://t.co/DBTNFnQm0k"
2022-01-27 19:03:06+00:00,c,Music industry clash: @AkikoFujita and @thebradsmith discuss the Neil Young and Spotify conflict: https://t.co/ANyc9DPunU
2022-01-27 19:00:01+00:00,c,WSJ special writer @GZuckerman says second and third generation COVID-19 vaccines are coming. WATCH Gregory’s full #Influencers interview now:  https://t.co/3nkDdgggUK https://t.co/afXl0htY9L
2022-01-27 18:49:38+00:00,c,"$INTC is building a $20B chip making plant in Central Ohio.

""I believe at the end, Intel liked the balance that we had,"" @JobsOhio CEO J.P. Nauseef says. ""Not only the site availability and the workforce, but we're an affordable state."" https://t.co/Jb7k9tf4PH https://t.co/NXVOOd84zf"
2022-01-27 18:31:21+00:00,c,".@Moderna_TX CMO Dr. Paul Burton on the $MRNA booster after 6 months: ""There is a waning of effect... I think we have to make the assumption that waning will continue and that coupled with the other data we have leads us to begin… to look at an Omicron-specific booster."" https://t.co/jwdJtRPICn"
2022-01-27 18:22:54+00:00,c,"Fed Chair Powell ""has to walk a very thin line, a very thin tightrope between not choking off the economic recovery, which does appear as though it's happening pretty well, but at the same time fighting off inflation,"" F.L. Putnam Portfolio Manager Ellen Hazen says. https://t.co/qgdGYDnMtF"
2022-01-27 18:19:53+00:00,c,Tesla stock slide 8% over supply-chain woes and new vehicle delays https://t.co/0OUOEICUdm by @alexandraandnyc https://t.co/Apc83cJJN7
2022-01-27 17:50:08+00:00,c,"Servicenow CEO Bill McDermott discusses interest rates, the outlook for the year, and more: https://t.co/c6spI1Yqqa"
2022-01-27 17:39:36+00:00,c,"In this episode of Yahoo Finance Presents, ServiceNow CEO Bill McDermott talks with Yahoo Finance on software stocks selling off, the demand for software during the pandemic, and how CEOs could keep employee morale up. Watch here: https://t.co/p072aTcOVl https://t.co/byQAeGUuwZ"
2022-01-27 17:38:20+00:00,c,"Tesla Optimus robot probably won't be a big profit driver, Wall Street thinks https://t.co/F9qUYsCFow by @BrianSozzi https://t.co/HEm6iTq7xS"
2022-01-27 17:37:59+00:00,c,"Apple to report earnings today, revealing its holiday sales amid chip shortage https://t.co/HtFR4qzthO by @DanielHowley https://t.co/eCgYYlQHyv"
2022-01-27 17:37:43+00:00,c,Trump’s Operation Warp Speed ‘very helpful’ for COVID vaccine development: author https://t.co/zs9yuQ5r4O by @MaxZahn_ and @serwer https://t.co/vH7ZNt3aqf
2022-01-27 17:36:41+00:00,c,USC Leventhal School of Accounting Associate Professor Greg Kling discusses what you need to know about the Child Tax Credit this tax season: https://t.co/3Rpo4FRhWb
2022-01-27 17:34:14+00:00,c,"BTIG Managing Director, Equity Research – Restaurants and Food Distribution Peter Saleh breaks down McDonald’s earnings: https://t.co/2Eo54OHn5k"
2022-01-27 17:30:36+00:00,c,"“What would be a big surprise to the market is if the demand side from consumer spending… stays pretty resilient, inflation keeps going up while staying high… and the Fed going more aggressively,” Equity Strategies for Research Affiliates CIO Feifei Li says. https://t.co/3lilw8G6uj"
2022-01-27 17:17:02+00:00,c,"“Right now, if you’re sitting on a student debt, the thing that you need is a good job with a solid pay check,” White House Council of Economic Advisers Member @econjared46 says. “Let’s not lose sight of how important the backdrop of this historically strong economy is."" https://t.co/zX2xVDs5Ug"
2022-01-27 17:12:56+00:00,c,"“If you look at whose wages are growing the fastest right now, if you look at whose employment opportunities are most robust, you will see it showing up in the bottom half of the income and pay scale,"" White House Council of Economic Advisers Member @econjared46 says. More: https://t.co/GXl4Cyeep2"
2022-01-27 16:55:46+00:00,c,"“We’re very excited about a lot of the things we have in store for 2022,” FTX US President @Brett_FTXUS says. “One of the biggest things is our derivatives platform.” More: https://t.co/rhDGprRyhf"
2022-01-27 16:42:35+00:00,c,"“It is all on the outlook,” Moor Insights &amp; Strategy CEO @PatrickMoorhead says about Intel. “They crushed their quarter, but it’s all about the outlook—specifically gross margin.” https://t.co/MyooSKcVaA"
2022-01-27 16:40:09+00:00,c,Mortgage rates settle after four weeks of increases https://t.co/OQZ8Q5cACW by @WritesRonda https://t.co/Z6Y1SFXUjU
2022-01-27 16:33:34+00:00,c,.@LeviStraussCoExecutive VP and CFO Harmit Singh breaks down the company’s earnings: https://t.co/dAHgeQD4Rf
2022-01-27 16:23:39+00:00,c,"“It wasn’t so much about what they said, it’s about what they didn’t say,” Oppenheimer Sr. Research Analyst Colin Rusch says about $TSLA earnings. “The reality is that they’re executing incredibly well along all of the key elements of their strategy.” More: https://t.co/YhAVMtc88M"
2022-01-27 16:19:18+00:00,c,"“The explicit signaling that the Fed intends to use both its conventional tools—the federal funds rate—and the unconventional tools—the balance sheet—should basically succeed in keeping inflation expectations anchored,” RSM Chief Economist @joebrusuelas says. More: https://t.co/K4hAJyFdsF"
2022-01-27 16:08:32+00:00,c,"“The economy is quite different,” Fed Chair Powell says. “It’s stronger, inflation is higher, the labor market is much stronger than it was, and growth is above trend. All of those things are going to go into our thinking as we make monetary policy.” https://t.co/VBEQo0K7Fg"
2022-01-27 16:02:55+00:00,c,Robinhood reports earnings today — Here's what to expect https://t.co/vd9SY0BNFG by @ines_ferre https://t.co/I7YptSVdzy
2022-01-27 16:00:03+00:00,c,‘A Shot to Save the World’ Author @GZuckerman explains how Trump’s Operation Warp Speed was “very helpful” for COVID vaccine development. WATCH Gregory’s full #Influencers interview now: https://t.co/3nkDdgggUK https://t.co/QVwPTSwwlJ
2022-01-27 15:59:43+00:00,c,"""The reason stocks are tumbling is because of the Fed potentially increasing rates,"" Wealthstream Advisors' Katharine George says. ""How that affects stocks is it makes it more expensive for the companies to borrow money, so it could potentially reduce future profits."" https://t.co/YbHaEKZTZB"
2022-01-27 15:46:30+00:00,c,"“Our business travel... is still down 50% compared to our pre-pandemic levels,” @SouthwestAir CEO @Gary_Kelly says. “We still had a strong revenue performance, I think that bodes well for the rest of the year. I’m hoping the last unprofitable months in 2022 are January-February.” https://t.co/xQHu0c6BoU"
2022-01-27 15:28:19+00:00,c,"“If the hikes are… maybe 2% in total over a couple of years… I think part of it will be good for the economy,” @RaymondJames CEO Paul Reilly says. “Part of this is punish-savers, people who are retirement and savings oriented and haven’t been able to earn anything off cash.” https://t.co/xl8NOpvQOF"
2022-01-27 15:19:25+00:00,c,"Bud Light launches zero-carb beer, NFT collection for 'next generation'
 https://t.co/4pEDNLsTX2 by @BrookeDiPalma https://t.co/tqMnGeLNlS"
2022-01-27 15:18:45+00:00,c,Pending home sales end 2021 on a low note https://t.co/7rzf9lklBR by @amandafung https://t.co/iULxk3kpIJ
2022-01-27 15:17:05+00:00,c,".@ines_ferre monitors the mega-caps in the Nasdaq and Dow such as $MCD, Chinese markets, shares tumbles in the EV space, and $HOOD. Full comments: https://t.co/0T15Boh14V"
2022-01-27 15:15:13+00:00,c,"“Once they get the Austin and Berlin [gigafactories] off the ground, they’ll have about 2 million units of capacity,” @WellsFargo Auto Analyst Collin Langan says on $TSLA, adding: “That’s going to put them up there with the best-selling mass-market vehicles.” https://t.co/kIPbrdSnc0"
2022-01-27 15:01:10+00:00,c,"The Fed sees “this as a very different cycle,” @JPMorganAM Global Market Strategist Gabriela Santos says. “They are not looking at a post-global financial crisis as the blueprint for what this rate hike cycle is going to look like, [and] that makes sense.” https://t.co/pD9JUVUVQ2"
2022-01-27 14:53:33+00:00,c,"“The number is more than $5T of excess savings that have accumulated in consumers’ bank accounts, essentially through the pandemic,” @DowNewsroom CFO @H_Ungerleider says, adding: “I think that’s why you’re seeing those inflationary numbers and the raw material costs increase.” https://t.co/QqT8gpy2Al"
2022-01-27 14:49:44+00:00,c,"Inflation, supply and labor woes a 'triple whammy' for Omicron-hit small biz https://t.co/9caNYtUU1y by @daniromerotv https://t.co/yGrsaQGu1d"
2022-01-27 14:42:48+00:00,c,".@SPYJared examines the overviews for the S&amp;P, Dow, gold, and bitcoin, as markets react to the latest FOMC announcements. Full comments: https://t.co/BzHYteCEek"
2022-01-27 14:33:22+00:00,c,"Bitcoin, crypto reverse post Fed gains, not 'enough reassurance to turn the tide' https://t.co/zhRLJaKqNY by @DsHollers https://t.co/94LtvEJHPO"
2022-01-27 14:32:06+00:00,c,"The Fed balance sheet is “still increasing, the process of adding assets to its holdings is going to stop in mid-March,” @bcheungz says on this week’s FOMC meeting. “That’s why the Fed says that mid-March [interest rate] hike is on the table."" https://t.co/N2kkmIkIaL"
2022-01-27 14:22:06+00:00,c,Why ServiceNow CEO Bill McDermott doesn't fear higher interest rates https://t.co/7WtZGWmnWW by @BrianSozzi https://t.co/64LSOkF0au
2022-01-27 14:21:30+00:00,c,US jobless claims trend down as Omicron disruptions begin to ease https://t.co/cd9Z3347WK by @alexandraandnyc https://t.co/HhKV5FOQQi
2022-01-27 14:21:07+00:00,c,"Q4 GDP: US economy expanded at 6.9% annualized rate, topping expectations https://t.co/KH0OTwHPOG by @emily_mcck https://t.co/nYEgd7HYEQ"
2022-01-27 14:02:17+00:00,c,Poll: Would you rather work four days per week in an office or five days per week remotely?
2022-01-27 14:00:02+00:00,c,"‘A Shot to Save the World’ Author @GZuckerman says COVID is “not going away,” but will “melt into the background.” WATCH Gregory’s full #Influencers interview now: https://t.co/3nkDdgggUK https://t.co/5BmoDhNxI9"
2022-01-27 13:36:39+00:00,c,"JUST IN: Jobless claims: Another 260,000 individuals filed new claims last week https://t.co/LvjlWolKQs by @alexandraandnyc https://t.co/djZYcmqh8h"
2022-01-27 13:32:27+00:00,c,"JUST IN: Q4 GDP: US economy expanded at 6.9% annualized rate, topping expectations https://t.co/YKIxEC8WEq by @emily_mcck https://t.co/bzpK83mQlE"
2022-01-27 13:15:41+00:00,c,"Ackman boosts Netflix, but here's why one bear thinks 'the dream is over' https://t.co/P1ZUi9Kr1p by @alliecanal8193 https://t.co/5B8EyjF3Bq"
2022-01-27 11:10:55+00:00,c,Beijing Olympics highlight growing divide between government and corporations on China https://t.co/SMF25zSDnE by @AkikoFujita https://t.co/Lvnuxct8HV
2022-01-27 10:49:11+00:00,c,"Semiconductor shortage has reached 'crisis' levels, Commerce Secretary says https://t.co/uRBbpGzU5c by @BrianSozzi https://t.co/MvUMgKlNvJ"
2022-01-27 10:24:28+00:00,c,"Why Starbucks, big food chains are favored by Wall Street after sell-off https://t.co/qKhjLIjTjj by @daniromerotv https://t.co/DiejTZYD5r"
2022-01-27 10:02:42+00:00,c,"Investor sentiment survey 'gives me a lot of comfort,' strategist says https://t.co/YATLPQ9ruT by @ines_ferre https://t.co/0RrnNqUAQs"
2022-01-27 09:41:08+00:00,c,Nvidia’s Arm deal ‘was dead from day 1’ — and that’s OK https://t.co/jXW3xADFxM by @DanielHowley https://t.co/qIUL76tnPE
2022-01-27 09:17:52+00:00,c,Republicans blasted for taking credit for infrastructure spending after voting ‘no’ https://t.co/EHgRETUBey by @benwerschkul https://t.co/iBQKkezUN2
2022-01-27 08:54:34+00:00,c,Covid ‘not going away’ but will ‘melt into the background’: Author https://t.co/bXJT6lQXFz by @MaxZahn_ and @serwer https://t.co/49tSdRkVMm
2022-01-27 08:34:24+00:00,c,IRS warns of inaccurate tax forms for the Child Tax Credit https://t.co/N7oWp4UmV9 by @__gabriellacruz https://t.co/LR06BIpw3d
2022-01-27 08:11:37+00:00,c,Inflation and retirement: Here's how retirees can navigate rising prices https://t.co/x67iZgfMjY by @KerryHannon https://t.co/ILFyHFTaE8
2022-01-27 07:48:03+00:00,c,Tax refund timeline: Here's when to expect yours https://t.co/02KW8NdZ3l by @JannaHerron https://t.co/eFsDJ3Q77N
2022-01-27 07:27:23+00:00,c,Q4 GDP preview: Economists look for growth acceleration before Omicron impact https://t.co/v2JxoZRKv5 by @emily_mcck https://t.co/qL5N48p2vY
2022-01-27 07:04:22+00:00,c,Tesla beats estimates on 4Q earnings but cites supply chain challenges in outlook https://t.co/gWALmZHd0t by @alexandraandnyc https://t.co/8BP4k1a3Gw
2022-01-27 06:41:45+00:00,c,"DataTrek: Big Tech unlikely to see selling relief despite Q4 earnings
 https://t.co/XHObMyLz94 by @daniromerotv https://t.co/fRiB6AvW9m"
2022-01-27 06:19:34+00:00,c,"Retail stocks trading slower, but still above pre-pandemic levels: study https://t.co/0d6H14ON7Q by @ines_ferre https://t.co/EAJStsIMlc"
2022-01-27 05:55:30+00:00,c,"Jobless claims preview: Another 258,000 individuals likely filed new claims last week https://t.co/CnAITkhFef by @alexandraandnyc https://t.co/xVfpv8Kulw"
2022-01-27 05:32:32+00:00,c,"Crypto exchange https://t.co/TnBINqMMtP closes capital raise, valued at $8B https://t.co/CvlLp64yYQ by @DsHollers https://t.co/hPoOCMO79s"
2022-01-27 05:11:30+00:00,c,3 reasons why the U.S. vaccine booster drive is sputtering https://t.co/xetKUNtEGx by @adrianambells https://t.co/AIRN5WJ3W3
2022-01-27 04:47:35+00:00,c,"Powell: March rate hike likely, as Fed looks to be ‘nimble’ on inflation https://t.co/eTSv8Q7QLn by @bcheungz https://t.co/HnM591RFa0"
2022-01-27 04:20:18+00:00,c,"After vicious stock market sell-off, it's time to buy: Goldman Sachs https://t.co/8ySdngzGjz by @BrianSozzi https://t.co/ZEMd5e0IKw"
2022-01-27 03:56:50+00:00,c,Ford CEO admires two electric vehicle makers https://t.co/RwWBgZw9S5 by @BrianSozzi https://t.co/CoIohVsD3L
2022-01-27 03:28:42+00:00,c,"Build Back Better bill is 'mission critical' for electric vehicle industry, Ford CEO says https://t.co/zV2GNjJu5z by @BrianSozzi https://t.co/avZo8TEv7i"
2022-01-27 02:52:48+00:00,c,"Fed holds rates at near zero, tees up interest rate increase to quell inflation https://t.co/IbtxbQV29x by @bcheungz https://t.co/v56Xqvr21w"
2022-01-27 02:24:56+00:00,c,McDonald's jumps into menu hack trend with four pairings https://t.co/HQULi4jbkN by @BrookeDiPalma https://t.co/j76gzGCjLt
2022-01-27 01:58:18+00:00,c,"GameStop stock pops, then loses gains amid market reversal https://t.co/qnThNtjcUe by @ines_ferre https://t.co/F7rOojW16u"
2022-01-27 01:35:38+00:00,c,DraftKings stock pops as Morgan Stanley highlights 'Too Big an Opportunity to Ignore' https://t.co/uP565jNjQD by @_JoshSchafer https://t.co/tDKT7FAN7H
2022-01-27 01:11:17+00:00,c,Ackman's Pershing Square takes new position in Netflix https://t.co/rueurCoocO https://t.co/kXod3lvCyN
2022-01-27 00:55:57+00:00,c,"Samsung says demand to recover in 2022, but supply chain challenges persist https://t.co/YuHOfBrTMm https://t.co/2JOucc6A7r"
2022-01-27 00:54:08+00:00,c,FAA chief to testify at U.S. House hearing on 5G impact on aviation safety https://t.co/RihFS1fguA https://t.co/Hhc5vU9YcY
2022-01-27 00:50:44+00:00,c,Amazon workers eligible to hold union election at New York warehouse: NLRB https://t.co/vxCCFqtK9U https://t.co/RSdNlG4f5K
2022-01-26 23:30:00+00:00,c,Elon Musk is offering to eat a happy meal on TV if McDonald’s agrees to accept Dogecoin as payment: https://t.co/iclJK8XzLt
2022-01-26 23:00:02+00:00,c,U.S. Commerce Secretary Gina Raimondo discusses Omicron and business leaders: https://t.co/Hs58qx1drx
2022-01-26 22:10:00+00:00,c,Fed Chair Jerome Powell announces that the Federal Open Market Committee has decided to keep interest rates near zero for the time being: https://t.co/vbJ0rSQlck https://t.co/mtTQvBQkYt
2022-01-26 22:00:06+00:00,c,"Jobless claims preview: Another 258,000 individuals likely filed new claims last week https://t.co/pigRi8zVKM by @alexandraandnyc https://t.co/e30H77rkGK"
2022-01-26 21:55:50+00:00,c,Point CEO &amp; Founder Eddie Lim on leveraging home equity and how rate hikes could impact housing prices: https://t.co/NfV0PjqYK4
2022-01-26 21:50:01+00:00,c,Chevron raises quarterly dividend by 8 cents https://t.co/gkbhdPNiWQ https://t.co/lI04krLrIw
2022-01-26 21:46:52+00:00,c,Nvidia’s Arm deal ‘was dead from day 1’ — and that’s OK https://t.co/YVWYQxsvKO by @DanielHowley https://t.co/RYcPiUZjB2
2022-01-26 21:45:37+00:00,c,"Powell: March rate hike likely, as Fed looks to be ‘nimble’ on inflation https://t.co/rZ25DrIwJ9 by @bcheungz https://t.co/mQxSrfcu7T"
2022-01-26 21:43:55+00:00,c,"""Many investors are really focused on near-term optics,"" KeyBanc Capital Markets Managing Director &amp; Senior Research Analyst John Vinh says, later adding: ""Investors are getting really nervous of where we are."" https://t.co/0cZcMNjteZ"
2022-01-26 21:33:21+00:00,c,.@Wedbush Securities Managing Director @DivesTech on $TSLA facing supply chain constraints throughout 2022: https://t.co/pQeAFAWU8p
2022-01-26 21:25:57+00:00,c,Intel first-quarter revenue forecast ahead of expectations https://t.co/680LLseC6u https://t.co/ZP1fIcUlSK
2022-01-26 21:23:47+00:00,c,.@RiverFrontIG Investment Group Chief Investment Strategist Chris Konstantinos on the Fed press conference meeting: “This is a classic case of the Fed being as transparent as they think they can be.” https://t.co/HTQromLKlj
2022-01-26 21:15:23+00:00,c,Tesla beats estimates on 4Q earnings but cites supply chain challenges in outlook https://t.co/yeHnW6qQwh by @alexandraandnyc https://t.co/nGU5zvskGW
2022-01-26 21:14:09+00:00,c,DraftKings stock pops as Morgan Stanley highlights 'Too Big an Opportunity to Ignore' https://t.co/skVsRzD0bh by @_JoshSchafer https://t.co/MgeezNuACi
2022-01-26 21:10:24+00:00,c,"GameStop stock pops, then loses gains amid market reversal https://t.co/LoRHxn3GJX by @ines_ferre https://t.co/ayZ3WEKzcI"
2022-01-26 21:09:17+00:00,c,"“If the Fed receives authorization from Congress and the president to launch a central bank digital currency…  they’re not going to be looking to rewrite the global financial system here,” @CoinDesk’s @nikhileshde says. “They’re just trying to do what they’ve always been doing.” https://t.co/LrZKnPSzJQ"
