date,identifier,tweets
2021-12-18 00:40:00+00:00,c,"Senator Ed Markey, sat down with Yahoo Finance to discuss his work with airlines throughout the pandemic, the traveler’s bill of rights, and his thoughts on progress with the Build Back Better bill. Watch here: https://t.co/5yUg9KlAWT https://t.co/BduDa3FTub"
2021-12-18 00:00:01+00:00,c,Here’s a recap of the Elizabeth Holmes trial: https://t.co/sl7onY8vVN https://t.co/7b1rDETNfj
2021-12-17 23:30:00+00:00,c,Social media platform Reddit that ignited the year’s meme stock frenzy just filed an IPO: https://t.co/LLCkwaBqds https://t.co/MGxPcPKVo3
2021-12-17 23:00:02+00:00,c,"Yahoo Finance Editor-at-Large Brian Sozzi, speaks with serial entrepreneur, Chairman, and CEO of Wonder Group, Marc Lore, about his recent mobile food venture 'Wonder' as well as the progress made in building utopian city Telosa in the U.S. Watch here: https://t.co/AB6qf9yxv7 https://t.co/QjHrvSEoUK"
2021-12-17 23:00:00+00:00,c,Sportswear giant Nike just took a big step into the metaverse: https://t.co/jicQ8ozokB https://t.co/AaivrzVjAx
2021-12-17 22:23:14+00:00,c,".@UnevenJustice Author Raj Rajaratnam on murky trading laws: “Since time immemorial, financiers had had a bad rap… Wall Street is a favorite whipping boy for politicians… If you want to curtail insider trading, you should go after the insider, not the market participant.” https://t.co/pPOjKvTaly"
2021-12-17 22:14:36+00:00,c,"“At the time, Bernie Madoff had pled guilty for running a Ponzi scheme, Americans had lost $7 trillion... because of the housing crisis precipitated by large banks,” @UnevenJustice Author Raj Rajaratnam says. “And the government went after a small sector, equity hedge funds.” https://t.co/PjN1elMHjg"
2021-12-17 22:06:02+00:00,c,"“401(k) plans are popular — they have limitations on pretax and post-tax — but there’s also deferred compensation plans, which have no limitations per se,” @EisnerAmper Partner Tim Speiss says on retirement planning. Full comments: https://t.co/2SlazwA8wT"
2021-12-17 22:01:24+00:00,c,"The prosecution enters into its rebuttal in the Elizabeth Holmes trial, @alexiskweed explains: https://t.co/gB6DnCEbBA"
2021-12-17 21:37:24+00:00,c,"Musician Bruce Springsteen sold his music catalog to Sony for $500 million, as the music streaming space provides a volatile market for rising artists. @alliecanal8193 explains: https://t.co/4HNG9PloaU"
2021-12-17 21:31:54+00:00,c,"“We’ve seen a customer shift and a shipment profile that shifted over to us at DHL Express, we predict that will continue throughout 2022,” @DHLexpress CEO Mike Parra says. “We don’t see pre-2019 air capacity back until sometime 2024.” https://t.co/84tKUBhy1c"
2021-12-17 21:23:01+00:00,c,"It’s growing increasingly unlikely that the President Biden-championed Build Back Better plan will be passed this calendar year, @rickjnewman explains: https://t.co/1nEmlshutc"
2021-12-17 21:18:21+00:00,c,"“The zero interest rate trade is over, we had so much fun talking about meme stocks this past year, valuations were thrown out the window,” @cwp_advisor Founder and CIO @coveredcalls says. “But that changes in a tightening environment.” https://t.co/5pShIIDodX"
2021-12-17 21:12:57+00:00,c,"AMC surges 23%, leading meme stocks higher https://t.co/2cC9wOARtn by @ines_ferre https://t.co/3benib9vxq"
2021-12-17 21:11:11+00:00,c,"Why tax season may be adding to the rout in Bitcoin, cryptocurrencies https://t.co/EbscoE2Xbd by @DsHollers https://t.co/98u9LCqLme"
2021-12-17 21:10:25+00:00,c,"“Most of this is a bit of a myth and a bit of hype,” @ManpowerGroup Chairman &amp; CEO @JonasPrising says on the Great Resignation. “Most of the resignations you see happening is the effect of a very tight labor market driving high wage inflation."" https://t.co/r6H3ieR8yA"
2021-12-17 21:08:02+00:00,c,"Find the latest personal finance news and updates to help you with investing, paying off debt, buying a home, retirement, and more at Yahoo Money. This Twitter Moment is sponsored by @TIAA.
https://t.co/Srp0Qk2dsN"
2021-12-17 21:04:24+00:00,c,"Find the latest personal finance news and updates to help you with investing, paying off debt, buying a home, retirement, and more at Yahoo Money. This Twitter Moment is sponsored by @TIAA. https://t.co/3h8Sw11ZWW"
2021-12-17 21:00:04+00:00,c,"“I was part of the effort 34 years ago to begin the ban on smoking on flights, that everyone thought was an absolute right that a passenger should have,” @SenMarkey (D-MA) says on banning alcohol on planes to prevent disruptions by passengers. Full comments: https://t.co/bsMEvg9JQy"
2021-12-17 20:49:17+00:00,c,"“We today have 12 stores, our plan's to have 30 by the end of next year,” @Parachutehome CEO @arielkaye says. “Retail for us is a place to really build relationships with our customers… we see this continued high-intent customer coming to our stores wanting to shop that way.” https://t.co/w4k42xcCKq"
2021-12-17 20:35:29+00:00,c,"The NFL has postponed three games to later time slots and dates this coming week after a surge of COVID cases among players, @_JoshSchafer explains: https://t.co/801LqQNiRC"
2021-12-17 20:30:19+00:00,c,"“The hospitals and states are on fire with Delta all over… here comes Omicron throwing kerosene on the fire,” San Francisco General Hospital’s Dr. @TraumaDocSF says. “Three [vaccinations] is the new 2… you have 70% less chance of going to the hospital and getting sick.” https://t.co/SsiZ1rF6Pa"
2021-12-17 20:17:26+00:00,c,Redditors react to possible IPO: 'to the centre of the earth's core' https://t.co/SANDXyzQy6 by @ines_ferre https://t.co/ZoSfuNMSxK
2021-12-17 20:16:02+00:00,c,"“We saw last cycle that when the Fed exceeded 2%, there were visible signs they were going too far,” @pgim Fixed Income Lead Economist Ellen Gaske says on interest rate hikes. “We think the Fed is not likely to make that same mistake.” https://t.co/gNfprXUfcC"
2021-12-17 20:04:03+00:00,c,"“A majority of Americans report that they’re anxious about their current financial situation,” @BPC_Bipartisan Associate Director of Economic Policy @RachelSnyderman says. “And what we’ve also seen… is a potential extension of the gender wage gap.” Full interview: https://t.co/mSzeCmHFYh"
2021-12-17 19:58:19+00:00,c,Tesla faces investor lawsuit over Musk tweets on 10% stock sales https://t.co/B0VQ0rsJmZ https://t.co/DlH6g61Ph4
2021-12-17 19:56:55+00:00,c,"“The defense is doing a good job of bringing up all possible reasons for the jury to conclude reasonable doubt,” former U.S. Assistant DA Michele Hagan tells @AlexisKWeed at the Elizabeth Holmes trial. Though, “we have rebuttal coming up.”

https://t.co/Jb7k9tf4PH https://t.co/DEXqTdn1AG"
2021-12-17 19:27:44+00:00,c,".@creditcardscom Senior Industry Analyst @tedrossman on the outlook for holiday retail sales: “The biggest reason for the November slowdown was people started early.”

https://t.co/Jb7k9tf4PH https://t.co/sXFaAv2bMJ"
2021-12-17 19:25:25+00:00,c,This week in Bidenomics: Build back later https://t.co/uHmGmN8RPL by @rickjnewman https://t.co/fXxLypdcib
2021-12-17 19:18:22+00:00,c,"“It’s been a head-spinning 48 hours,” Tocqueville Asset Management's @Jpetrides2 says. “You’ve gone from a relief that the Fed is not behind the curve in raising rates to now fears that Omicron is real, and it could help slow the economy more so than expected in 2022.” https://t.co/NKHMWC8rRY"
2021-12-17 18:56:48+00:00,c,Nationwide Retirement Institute Senior Vice President Kristi Rodriguez explains how GenZ and millennials should approach retirement planning and financial advice on social media: https://t.co/JChAtABwZD
2021-12-17 18:51:25+00:00,c,"“We’ve seen very rapid price appreciation and demand for larger homes, more expensive homes,” @OxfordEconomics' @GregDaco says. “There is very little market at this point for smaller or mid-sized homes that may be a bit cheaper. ... That bifurcation is likely to remain in place.” https://t.co/iNxN58lVkV"
2021-12-17 18:34:15+00:00,c,"“We’re going to have a community foundation to own the land that’s worthless,” Wonder Group's @MarcLore says about building the utopian city of Telosa. “If people move there and the land appreciates in value, we can capture all that appreciation and give it back to the citizens.” https://t.co/6FQYahhEI8"
2021-12-17 18:26:52+00:00,c,"“We have a notable increase across the United States of [COVID hospital] admissions,” Univ. of Illinois Emergency Medicine Residency Assistant Program Director @DrChrisER says. “This will be a really, really tough winter for those individuals who have not received the vaccine.” https://t.co/Y91pvAyGJM"
2021-12-17 18:19:21+00:00,c,"“Volatility is back in the near term at least,” @FortPittCapital CIO Dan Eye says. “The trading activity that we’ve seen… is really indicative of markets adjusting to the new reality of waning liquidity and the prospects for tighter policy from the Fed going forward.” https://t.co/Kg8ECsaIoR"
2021-12-17 18:00:06+00:00,c,"“So on inflation, we do have a controversial call here, @ARKinvest CEO @CathieDWood says. “I think the prevailing wisdom here is we have an inflation problem. This is not transitory. The supply chain bottlenecks have lasted a lot longer than I would’ve expected.“ https://t.co/QOAWzuhkrX"
2021-12-17 17:59:57+00:00,c,"US eyes crypto, climate among potential risks to financial stability https://t.co/Eybhxqr4sp by @Jenniferisms https://t.co/SVPHrC2k72"
2021-12-17 17:52:13+00:00,c,"VeeFriends CEO @garyvee on the metaverse: ""I really think people are going to spend ungodly amounts of time in VR and AR over the next 20 years. I just think buying property or virtual goods for the flex of us being in there is a hair premature because there’s not enough scale."" https://t.co/MczEvVECap"
2021-12-17 17:50:13+00:00,c,"“I don’t see a world in 2032 where every ticket to every sporting event is not an NFT,” Serial entrepreneur &amp; VeeFriends CEO @garyvee says. “You’re going to see the costs so low that it’s going to be a question of: Why wouldn’t you create an NFT for a membership, for a ticket?” https://t.co/Bqm8jhkQIn"
2021-12-17 17:39:52+00:00,c,"“A lot of these businesses came out with really, really, just overheated valuations,” New Constructs CEO David Trainer says about the over hyped IPO’s throughout the year. “They really weren’t very well competitively positioned businesses” https://t.co/GivTbJi8Wj"
2021-12-17 17:33:27+00:00,c,11 neglected stocks that may rise at least 20% in 2022: BofA https://t.co/Mnk3EjBeJ2 by @BrianSozzi https://t.co/wO0HJ7Iei1
2021-12-17 17:25:20+00:00,c,"“Up until this year with Dicks Sporting goods and Moolah Kicks, women have been shopping in the children’s or mens section for their sneakers,"" @moolahkicks CEO Natalie White says about why she created a women’s basketball sneaker line. https://t.co/tFZJtKI5yz"
2021-12-17 17:14:17+00:00,c,"“This year has been huge year for mainstream consumer demand into crypto,” BlockFi Co-Founder &amp; SVP of Operations @founderflori says. “One in ten people plan to gift crypto this year.” More: https://t.co/7if3NaaX27"
2021-12-17 16:53:08+00:00,c,Decentralized Artist Jesus Martinez discusses how he became an NFT artist: https://t.co/nWAeg1qA7R
2021-12-17 16:43:09+00:00,c,"“The short-term pressures could be substantial,” BCG CEO Rich Lesser says about the effect of the omicron variant on the economy. “I do remain, from an economic point of view, optimistic for the year ahead. I think we’re on track for a good year.” More: https://t.co/1QLn9DFj5W"
2021-12-17 16:21:05+00:00,c,"“It’s not 2020, we have a lot of advantages over 2020,” Yale Public Health Professor @thehowie says about the omicron variant concerns. “But, we have a widely open society right now… we have COVID fatigue... and we have an enormously infectious variant.” https://t.co/RuvSVjR2Hu"
2021-12-17 15:55:10+00:00,c,"The most important question for investors in 2022,’ according to one expert https://t.co/5vfwdH7lIl by @IFanusie https://t.co/pAvMyAn1Xj"
2021-12-17 15:54:45+00:00,c,"Retirement expert: Social Security benefits could see a ‘fairly big’ increase next year, too https://t.co/4Fv7LJFtNR https://t.co/3FrxZOHCWH"
2021-12-17 15:54:12+00:00,c,.@MPMaterials CEO James Litinksy discusses the company’s long-term rare earth supply deal with GM: https://t.co/9ECeuNCvvC
2021-12-17 15:47:02+00:00,c,"“This has affected everyone and certainly the supply chain,” Transfix CEO Lily Shen says about the pandemic. “With the supply chain, we continue to see disruptions across the board. The truth is, these challenges in the supply chain have actually existed for decades.” https://t.co/S1G3cwklkM"
2021-12-17 15:44:16+00:00,c,Big airlines are cutting dozens of second-tier routes as travel rebounds amid pandemic https://t.co/V2p6rfsyRn by @adrianambells https://t.co/hwOHOu2yXp
2021-12-17 15:29:54+00:00,c,"“We believe businesses can do well and do good,” Warby Parker co-founder and co-CEO Neil Blumenthal says. “Having this brighter spotlight to showcase how we provide a pair of glasses for every pair that we sell… is really exciting to us.” https://t.co/mF9u8FZJSw"
2021-12-17 15:28:59+00:00,c,"Warby Parker co-founders and co-CEOs Neil Blumenthal and Dave Gilboa discuss holiday shopping, in-store traffic trends, product development, and more: https://t.co/tvQXZSsd00"
2021-12-17 15:19:18+00:00,c,"Robinhood stock entering 2022 on low note after Congressional hearing, IPO, crypto bonanza https://t.co/j8bjrWuc8l by @ines_ferre https://t.co/kRo0wzjLPr"
2021-12-17 15:17:01+00:00,c,"“We’re seeing 2022 as the year when ESG not only becomes mainstream, but it starts driving markets a lot more,” Jefferies Global Head of ESG Aniket Shah says. “Core parts of the financial system are going to become even more serious about climate change.” https://t.co/vQomPSKUVr"
2021-12-17 15:02:11+00:00,c,Ray Dalio: It's 'very impressive' that cryptocurrency has 'held up' for a decade https://t.co/2zQLXTloxl by @benwerschkul https://t.co/e4RVpsnB5D
2021-12-17 15:01:30+00:00,c,"“The domestic parcel market is set to grow 70% by 2026,” Baird Analyst Garret Holland says on $FDX. “Now, clearly there’s going to be a remix in spend from goods back to services, … but that secular tailwind from e-commerce growth is a clear positive” for FedEx. Full interview: https://t.co/mACbUIcK8W"
2021-12-17 14:52:00+00:00,c,"Senator Ed Markey, sat down with Yahoo Finance to discuss his work with airlines throughout the pandemic, the traveler’s bill of rights, and his thoughts on progress with the Build Back Better bill. Watch here: https://t.co/5yUg9KlAWT https://t.co/gvM9SmuzIJ"
2021-12-17 14:40:05+00:00,c,J.P.Morgan Securities to pay $200 million to settle U.S. regulatory charges on record-keeping lapses https://t.co/1BR6RdjDbk https://t.co/OXNmx1trZx
2021-12-17 14:36:43+00:00,c,"A U.S. consumer watchdog is launching a probe into buy now, pay later companies, seeking information from Affirm, Afterpay, Klarna, PayPal, and Zip. @bcheungz explains: https://t.co/iVSlTCnkU3"
2021-12-17 14:30:21+00:00,c,"Yahoo Finance Editor-at-Large Brian Sozzi, speaks with serial entrepreneur, Chairman, and CEO of Wonder Group, Marc Lore, about his recent mobile food venture 'Wonder' as well as the progress made in building utopian city Telosa in the U.S. Watch here: https://t.co/AB6qf9yxv7 https://t.co/69PaS5zErS"
2021-12-17 14:24:04+00:00,c,"“Roughly a third of the people... haven’t seen anything other than this extraordinary bull market,” Interactive Brokers Chief Strategist @SteveSosnick says. “This is a time to be thinking about options more as a hedge or an income strategy than just outright speculation.” https://t.co/wD3tl9CBAT"
2021-12-17 14:22:56+00:00,c,"Omicron: 'The good news is that we have the tools,' doctor says https://t.co/5dWaiTa8od by @adrianambells https://t.co/9vWJ8K5ahV"
2021-12-17 14:22:21+00:00,c,FedEx reveals a stunning stat that shows the job market is really hot https://t.co/MO5qkZIxbk by @BrianSozzi https://t.co/wcr1LH4BYx
2021-12-17 14:20:04+00:00,c,"“The market is saying that they don’t see a big will for lockdown in the U.S.,” Interactive Brokers Chief Strategist @SteveSosnick says about the Omicron variant. “It’s a human problem, but it’s not necessarily a market problem — for now.” Full comments: https://t.co/S4oRIICvsH"
2021-12-17 12:43:03+00:00,c,Elizabeth Holmes prosecutor: 'You should find her guilty because of her words' https://t.co/TKcCghYybT by @alexiskweed https://t.co/cKsML4KMF0
2021-12-17 11:39:11+00:00,c,"China, still a 2022 worry: Morning Brief https://t.co/QGsD8gWdxc by @TeflonGeek https://t.co/asQlxAdyLk"
2021-12-17 06:16:48+00:00,c,Why analysts love Apple right now https://t.co/4HHHb5IQh4 by @DanielHowley https://t.co/c6pxbkLXpM
2021-12-17 05:24:31+00:00,c,Ray Dalio: Any war with China is 'likely to be around Taiwan' https://t.co/W1f14Y3alG https://t.co/ObktxrBjTn
2021-12-17 04:45:59+00:00,c,Meta/Facebook is the worst company of the year: Yahoo Finance readers https://t.co/GrdPK7cFOp by @ewolffmann https://t.co/2pkuGDDPg1
2021-12-17 04:11:52+00:00,c,The White House warns CEOs of elevated hacking threats during the holidays https://t.co/kSmuoG7Jlk by @benwerschkul https://t.co/Een5YV7dwI
2021-12-17 03:47:29+00:00,c,Now you can invest in the future of bowling https://t.co/egcMFjC6SS by @BrianSozzi https://t.co/mU5yLAADQp
2021-12-17 03:23:49+00:00,c,Chainalysis: crypto scam revenues surge as 'rug pulls' become 'go-to' for crooks https://t.co/ZxQFFAWeta by @DsHollers https://t.co/YC34f1KDcr
2021-12-17 02:18:49+00:00,c,What Biden left undone in 2021 https://t.co/TDRyfNdD92 by @rickjnewman https://t.co/yHWZx1AcvR
2021-12-17 01:50:19+00:00,c,Elizabeth Holmes closing arguments: Prosecutors will get first and final word https://t.co/GivKE7YUXR by @alexiskweed https://t.co/YrWVeQtDzQ
2021-12-17 00:48:02+00:00,c,The hottest housing market of 2021 https://t.co/FPA85Xuu8T by @amandafung https://t.co/LUQSJsOQX9
2021-12-17 00:25:18+00:00,c,Walmart's former secret weapon Marc Lore is trying to change the world https://t.co/0FkQs8JgrJ by @BrianSozzi https://t.co/InQ4DMAqes
2021-12-17 00:00:34+00:00,c,Fed faces a judgment call on finding 'maximum employment' https://t.co/NXNMFTJ83V by @bcheungz https://t.co/yB46YUL7Rh
2021-12-17 00:00:01+00:00,c,Here’s what to expect in the closing arguments of the Theranos and Elizabeth Holmes trial: https://t.co/neH1XZqoBb https://t.co/XxWUFpuFei
2021-12-16 23:30:00+00:00,c,President Biden pledges government will pay for the first 30 days of tornado recovery efforts: https://t.co/gqk0gipOFY https://t.co/d613r59QLb
2021-12-16 23:25:33+00:00,c,Activist investor dials up pressure against Exxon Mobil to act on climate https://t.co/5ps9vH0scI by @AkikoFujita https://t.co/pSOZQvCqCk
2021-12-16 23:04:18+00:00,c,"Bitcoin, crypto boosted by Fed relief rally, investors 'bracing for the worst' get surprised https://t.co/FBqizUnBtb by @DsHollers https://t.co/lSNUtgnvhZ"
2021-12-16 23:00:01+00:00,c,This air purifier offers “personal air protection” you can wear: https://t.co/IizaaIHJlo
2021-12-16 22:45:29+00:00,c,"“It’s an incredibly large industry — $69 billion in the U.S. ... so we’re excited to see how we can possibly lead that part of the marketplace,” @FreshVineWine CEO Janelle Anderson says on the brand’s IPO. She is joined by Co-Owners @ninadobrev and @juliannehough. Full comments: https://t.co/18efpkGNS5"
2021-12-16 22:41:57+00:00,c,Fed faces a judgment call on finding 'maximum employment' https://t.co/nPp97MABoA by @bcheungz https://t.co/ZbwVDPi4iB
2021-12-16 22:02:38+00:00,c,"Bridgewater Associates Founder @RayDalio on cryptocurrency: “I don’t own a lot of it, I view it as an alternative money in an environment where the value of cash money is depreciating in real terms… I would like to say that cash… I think, is the worst investment.” https://t.co/sLQCmriEDc"
2021-12-16 22:00:00+00:00,c,WATCH NOW: Bridgewater Associates founder and billionaire investor @RayDalio joins #Influencers with Andy @serwer https://t.co/QioRdSEjQq https://t.co/4HvR54IfKe
2021-12-16 21:52:25+00:00,c,"Bridgewater Associates Founder @RayDalio on economic competition: “When I first started to go to China in 1984, its real income has increased by 26 times. If you just extrapolate lines and you look at productivity… it’s a very likelihood China… would become a greater power.” https://t.co/kO7tNdH5UA"
2021-12-16 21:43:59+00:00,c,"Bridgewater Associates Founder @RayDalio on historical conflicts: “When there’s a financial problem, when the granaries are empty, they print money… [and] and it devalues money. And with that, you have a large gap of people at each other’s throats.” https://t.co/Sfd81quuuH"
2021-12-16 21:39:54+00:00,c,Kellogg reaches another tentative deal with union: Omaha union president https://t.co/XOjBdVtHDt https://t.co/W6piG1khxI
2021-12-16 21:38:03+00:00,c,"EV startup Rivian to build $5 billion plant in Georgia, posts quarterly loss https://t.co/R0Vbqq1EzI https://t.co/hFU4HWcJv7"
2021-12-16 21:34:45+00:00,c,FedEx returns to original profit target ahead of holiday peak https://t.co/ygCF10EWJ0 https://t.co/K03A2GPSXN
2021-12-16 21:31:09+00:00,c,"“Theft of intellectual property can be turned into money either by the direct sale or ransoming,” National Cyber Director @ncdinglis says on cyberattacks. “We should consider this [threat] to be somewhat borderless in terms of sources.” https://t.co/nlI6siYIwo"
2021-12-16 21:23:42+00:00,c,"“As you get closer to Christmas, if there's issues in the product availability, you’ll see a lot more spent on gift cards,” @ICSC’s @TomMcGeeCEO says. “A gift card allows individuals to pick something up post-holiday… suggesting January and February sales will be quite good.” https://t.co/X2VnAa3wGi"
2021-12-16 21:15:27+00:00,c,"Nasdaq sheds 2.5%, weighed down by broader tech sell-off https://t.co/AXXLqFZaUh by @alexandraandnyc https://t.co/iYMzrnU5jw"
2021-12-16 21:15:16+00:00,c,"“Most profound thing in the energy markets… is that natural gas prices hit the… equivalent of $270 a barrel,” @InfraCap's Jay Hatfield says. “Energy transition has blown up in Europe… it may halt the movement towards reducing carbon… people literally can’t pay their bills.” https://t.co/KJWmDjcWal"
2021-12-16 20:58:07+00:00,c,"“It’s a fixed income market — if interest rates rise, it will impact municipal prices, they will go down,” @BlackRock Head of Municipal Bonds Group Peter Hayes says. “Municipals tend to do better in rising rate environments than other asset classes.” https://t.co/5nGdcIXoHQ"
2021-12-16 20:50:37+00:00,c,"“People figure out ways to get through the holidays, you want to give your family gifts,” USPA Global Licensing CEO J. Michael Prince says. “Consumers will have to make decisions, if I... spend an extra $2,400 a year because of inflationary increases, where do I not spend money?” https://t.co/8a7go6d3D0"
2021-12-16 20:43:44+00:00,c,.@Ajshaps and @emily_mcck break down end of day trading for $DAL $ADBE $FDX $T and more: https://t.co/rqXzV9K1AZ
2021-12-16 20:34:02+00:00,c,"“There’s several possibilities omicron might completely displace delta or co-circulate at the same time,” University of Virginia’s Dr. @TaisonBell says. “We’re here again where we have to prepare for a surge — the difference now is that our [hospital] staffing is a lot worse.” https://t.co/9Xk6XQ9Sqs"
2021-12-16 20:22:07+00:00,c,Activist investor dials up pressure against Exxon Mobil to act on climate https://t.co/632Q9uKXwN by @AkikoFujita https://t.co/vhoBRhBM7H
2021-12-16 20:15:56+00:00,c,"“It’s important from time to time to divorce the progress of the real economy from capital markets,” @fsinvestments Chief Market Strategist Troy Gayeski says. “Typically capital markets behave better… because you have operating… and balance sheet leverage and equities.” https://t.co/nL33POdH3s"
2021-12-16 20:03:46+00:00,c,".@BrookeDiPalma tries Lay’s new limited-edition vodka: “It contains Lay’s proprietary potatoes… as well as Portland potatoes, so a blend… to create this 40% alcohol, 80 proof potato vodka. … It is already sold out.” https://t.co/XkgGRDaIbV"
2021-12-16 20:03:36+00:00,c,What Biden left undone in 2021 https://t.co/CSqEskfTHL by @rickjnewman https://t.co/EgLwiIXWuo
2021-12-16 19:53:14+00:00,c,Fed faces a judgment call on finding 'maximum employment' https://t.co/lads7oYvh0 by @bcheungz https://t.co/dV5gOmowCw
2021-12-16 19:52:27+00:00,c,"“What we’re hearing today are the closing arguments from the prosecution,” @AlexisKWeed reports from the Elizabeth Holmes trial. The prosecution “is trying to tie together all of the evidence, and that’s difficult because there are more than 900 pieces.” 

https://t.co/Jb7k9tf4PH https://t.co/ZZrwTbp7TT"
2021-12-16 19:46:07+00:00,c,Manhattan Buyers Co-Founder Arthur Abrams explains why the secondhand jewelry business is “recession-proof”: https://t.co/yIg4rVUWP5
2021-12-16 19:43:02+00:00,c,"Bridgewater Associates founder @RayDalio on U.S.-China relations: “If there’s going to be a military war issue, it is likely to be around Taiwan.” 

https://t.co/Jb7k9tf4PH https://t.co/qKLolZRT2b"
2021-12-16 19:40:09+00:00,c,Ray Dalio: Any war with China is 'likely to be around Taiwan' https://t.co/Fhwyo3FcCQ https://t.co/aMll4cCUq4
